Description,ASIN,Product URL
Carhartt Men's Rugged Professional Cap,B07M5M38KG,https://www.amazon.com//Carhartt-Mens-Rugged-Professional-Khaki/dp/B07M5M38KG/ref=sr_1_148?dchild=1&keywords=hat&qid=1626700864&sr=8-148
adidas Originals Women's Mini Logo Relaxed Cap,B087MBZY2T,https://www.amazon.com//adidas-Originals-Mini-Relaxed-Color/dp/B087MBZY2T/ref=sr_1_149?dchild=1&keywords=hat&qid=1626700864&sr=8-149
"Ergodyne - 12686 Chill Its 6632 Cooling Skull Cap, Sweat Wicking Helmet Liner, UPF 50 Sun Protection Black",B084SB57X9,https://www.amazon.com//Ergodyne-6632-Cooling-Wicking-Protection/dp/B084SB57X9/ref=sr_1_150?dchild=1&keywords=hat&qid=1626700864&sr=8-150
ASICS Storm Shelter Cap,B00AJ4ARDW,https://www.amazon.com//ASICS-Storm-Shelter-Atomic-Blue/dp/B00AJ4ARDW/ref=sr_1_151?dchild=1&keywords=hat&qid=1626700864&sr=8-151
PUMA Men's Evercat Mesh Stretch Fit Cap,B0747H714L,https://www.amazon.com//PUMA-Evercat-Alloy-Stretch-White/dp/B0747H714L/ref=sr_1_152?dchild=1&keywords=hat&qid=1626700864&sr=8-152
"LADYBRO 2Pack Unisex Flat Cap Newsboy Hats for Men Women, Scally Cap Summer Hat for Golf",B094FCT9CW,https://www.amazon.com//gp/slredirect/picassoRedirect.html/ref=pa_sp_btf_aps_sr_pg3_1?ie=UTF8&adId=A09434612WR3QF7QO318L&url=%2FLADYBRO-Unisex-Newsboy-Scally-Summer%2Fdp%2FB094FCT9CW%2Fref%3Dsr_1_153_sspa%3Fdchild%3D1%26keywords%3Dhat%26qid%3D1626700864%26sr%3D8-153-spons%26psc%3D1&qualifier=1626700864&id=2305814486992406&widgetName=sp_btf
"Husqvarna 599410301 Xplorer Jakt Hunt Hat, Camo",B08CRTVG5Y,https://www.amazon.com//gp/slredirect/picassoRedirect.html/ref=pa_sp_btf_aps_sr_pg3_1?ie=UTF8&adId=A071488328IOY7B8HSQAY&url=%2FHusqvarna-599410301-Xplorer-Jakt-Hunt%2Fdp%2FB08CRTVG5Y%2Fref%3Dsr_1_154_sspa%3Fdchild%3D1%26keywords%3Dhat%26qid%3D1626700864%26sr%3D8-154-spons%26psc%3D1&qualifier=1626700864&id=2305814486992406&widgetName=sp_btf
Winter Windproof Waterproof Face Mask Balaclava Ski Mask Cold Weather Gear,B07HG26818,https://www.amazon.com//gp/slredirect/picassoRedirect.html/ref=pa_sp_atf_next_aps_sr_pg4_1?ie=UTF8&adId=A06177603HJCF44JGNIZD&url=%2FBalaclava-Weather-Windproof-Waterproof-Thermal%2Fdp%2FB07HG26818%2Fref%3Dsr_1_145_sspa%3Fdchild%3D1%26keywords%3Dhat%26qid%3D1626700868%26sr%3D8-145-spons%26psc%3D1%26smid%3DA3IR07TGV3RZ4A&qualifier=1626700868&id=1601064244581478&widgetName=sp_atf_next
M&P Ladies Reflective Logo Running Cap in Black - Officially Licensed,B07J4XJ31Z,https://www.amazon.com//gp/slredirect/picassoRedirect.html/ref=pa_sp_atf_next_aps_sr_pg4_1?ie=UTF8&adId=A0229676TV8YM55CFQOB&url=%2FLadies-Reflective-Logo-Running-Black%2Fdp%2FB07J4XJ31Z%2Fref%3Dsr_1_146_sspa%3Fdchild%3D1%26keywords%3Dhat%26qid%3D1626700868%26sr%3D8-146-spons%26psc%3D1&qualifier=1626700868&id=1601064244581478&widgetName=sp_atf_next
KOOLSOLY Breathable Wide Brim Boonie Hat Outdoor Waterproof UPF 50+ Sun Protection Mesh Safari Sun hat for Travel Fishing,B07TKTDY2Z,https://www.amazon.com//gp/slredirect/picassoRedirect.html/ref=pa_sp_atf_next_aps_sr_pg4_1?ie=UTF8&adId=A00970882IKYOTM2Z92QG&url=%2FKOOLSOLY-Breathable-Outdoor-Waterproof-Protection%2Fdp%2FB07TKTDY2Z%2Fref%3Dsr_1_147_sspa%3Fdchild%3D1%26keywords%3Dhat%26qid%3D1626700868%26sr%3D8-147-spons%26psc%3D1&qualifier=1626700868&id=1601064244581478&widgetName=sp_atf_next
"PF50+ Sun Hat Waterproof Bucket Hat for Fishing, Hiking, Camping",B08YXQFS93,https://www.amazon.com//gp/slredirect/picassoRedirect.html/ref=pa_sp_atf_next_aps_sr_pg4_1?ie=UTF8&adId=A10398551EJ0HONJJLCIP&url=%2FWaterproof-Bucket-Fishing-Hiking-Camping%2Fdp%2FB08YXQFS93%2Fref%3Dsr_1_148_sspa%3Fdchild%3D1%26keywords%3Dhat%26qid%3D1626700868%26sr%3D8-148-spons%26psc%3D1&qualifier=1626700868&id=1601064244581478&widgetName=sp_atf_next
Womens Sun Straw Hat Wide Brim UPF 50 Summer Hat Foldable Roll up Floppy Beach Hats for Women,B085L7TRKJ,https://www.amazon.com//Womens-Summer-Foldable-Floppy-Circum/dp/B085L7TRKJ/ref=sr_1_149?dchild=1&keywords=hat&qid=1626700868&sr=8-149
FURTALK Sun Visor Hats for Women Wide Brim Straw Roll Up Ponytail Summer Beach Hat UV UPF Packable Foldable Travel,B07NZNP3Z9,https://www.amazon.com//Ponytail-Summer-Foldable-Packable-FURTALK/dp/B07NZNP3Z9/ref=sr_1_150?dchild=1&keywords=hat&qid=1626700868&sr=8-150
Roxy Women's Truckin,B01N0OE9NY,https://www.amazon.com//Roxy-Womens-Truckin-Trucker-Anthracite/dp/B01N0OE9NY/ref=sr_1_151?dchild=1&keywords=hat&qid=1626700868&sr=8-151
Sunday Afternoons Artist Series Cooling Trucker,B085DT8YR4,https://www.amazon.com//Sunday-Afternoons-Unisex-Adult-Cooling-Trucker/dp/B085DT8YR4/ref=sr_1_152?dchild=1&keywords=hat&qid=1626700868&sr=8-152
Ariat Men's Solid Black Corner Brand,B01EU1L8VY,https://www.amazon.com//Ariat-Solid-Corner-Brand-Black/dp/B01EU1L8VY/ref=sr_1_153?dchild=1&keywords=hat&qid=1626700868&sr=8-153
Nautica Men's Classic Logo Adjustable Baseball-Cap Hat,B0059JQPJW,https://www.amazon.com//Nautica-Mens-Twill-6-Panel-Black/dp/B0059JQPJW/ref=sr_1_154?dchild=1&keywords=hat&qid=1626700868&sr=8-154
ARIAT Men's RWB Shield Logo Flexfit110 Snapback Cap,B07NXVCB6K,https://www.amazon.com//ARIAT-Shield-Flexfit110-Snapback-Heather/dp/B07NXVCB6K/ref=sr_1_155?dchild=1&keywords=hat&qid=1626700868&sr=8-155
Vineyard Vines Men's Classic Whale Logo Baseball Hat,B0059HX4MA,https://www.amazon.com//Vineyard-Vines-Whale-Logo-Baseball/dp/B0059HX4MA/ref=sr_1_156?dchild=1&keywords=hat&qid=1626700868&sr=8-156
adidas Men's Marine Stretch Fit Cap,B00LU1CPF6,https://www.amazon.com//adidas-Marine-Stretch-Bright-X-Large/dp/B00LU1CPF6/ref=sr_1_157?dchild=1&keywords=hat&qid=1626700868&sr=8-157
PUMA Men's Evercat Dillon 2.0 Stretch Fit Cap,B07N82HN92,https://www.amazon.com//PUMA-Evercat-Dillon-Stretch-Black/dp/B07N82HN92/ref=sr_1_158?dchild=1&keywords=hat&qid=1626700868&sr=8-158
Port Authority Adjustable Mesh Back Cap (C911),B00TSNZC12,https://www.amazon.com//Port-Authority-Mens-Adjustable-Green/dp/B00TSNZC12/ref=sr_1_159?dchild=1&keywords=hat&qid=1626700868&sr=8-159
adidas Men's Ultimate Relaxed Cap,B07D9F42BJ,https://www.amazon.com//adidas-Ultimate-Relaxed-Adjustable-Black/dp/B07D9F42BJ/ref=sr_1_160?dchild=1&keywords=hat&qid=1626700868&sr=8-160
ARIAT Men's Oilskin Mesh Hat,B00P3Y27WW,https://www.amazon.com//ARIAT-Mens-Oilskin-Mesh-Brown/dp/B00P3Y27WW/ref=sr_1_161?dchild=1&keywords=hat&qid=1626700868&sr=8-161
Tilley mens Outdoor Hat,B000E9C12M,https://www.amazon.com//Tilley-Endurables-LTM3-Airflo-Khaki/dp/B000E9C12M/ref=sr_1_162?dchild=1&keywords=hat&qid=1626700868&sr=8-162
Oakley Men's Si Cap,B012HAVCJ8,https://www.amazon.com//Oakley-Mens-Cap-Coyote-X-Large/dp/B012HAVCJ8/ref=sr_1_163?dchild=1&keywords=hat&qid=1626700868&sr=8-163
Ariat Men's Black Red Gray Mesh Hat,B00PCUP3FK,https://www.amazon.com//Ariat-Mens-Gray-Mesh-Black/dp/B00PCUP3FK/ref=sr_1_164?dchild=1&keywords=hat&qid=1626700868&sr=8-164
Nike Aerobill Featherlight Dri-Fit White Unisex Running Tennis Cap CI2662-100,B0893FXSP5,https://www.amazon.com//Nike-Aerobill-Featherlight-Dri-Fit-CI2662-100/dp/B0893FXSP5/ref=sr_1_165?dchild=1&keywords=hat&qid=1626700868&sr=8-165
Pistil Women's Lotus Sun Hat,B013WDIPJ4,https://www.amazon.com//Pistil-Womens-Lotus-Sun-White/dp/B013WDIPJ4/ref=sr_1_166?dchild=1&keywords=hat&qid=1626700868&sr=8-166
ARIAT Heather Teal Mesh Cap,B074TGYQNN,https://www.amazon.com//Ariat-Mens-Heather-Teal-Mesh/dp/B074TGYQNN/ref=sr_1_167?dchild=1&keywords=hat&qid=1626700868&sr=8-167
ARIAT Mens Sport Patriot Ball Cap,B076MDP4LL,https://www.amazon.com//Ariat-Patriot-Fabric-Multi-Color/dp/B076MDP4LL/ref=sr_1_168?dchild=1&keywords=hat&qid=1626700868&sr=8-168
Outdoor Research Towers Trucker Cap,B078XY5C3K,https://www.amazon.com//Outdoor-Research-Towers-Trucker-1size/dp/B078XY5C3K/ref=sr_1_169?dchild=1&keywords=hat&qid=1626700868&sr=8-169
Hurley Men's Dri-fit One & Only Flexfit Baseball Cap,B07ZPRD7C5,https://www.amazon.com//Hurley-Dri-Fit-Flexfit-Baseball-Black/dp/B07ZPRD7C5/ref=sr_1_170?dchild=1&keywords=hat&qid=1626700868&sr=8-170
Nike Unisex Sportswear Heritage86 Cap,B077SWWTRG,https://www.amazon.com//NIKE-Unisex-Sportswear-Heritage86-Black/dp/B077SWWTRG/ref=sr_1_171?dchild=1&keywords=hat&qid=1626700868&sr=8-171
Psycho Bunny Men's Sunbleached Cap,B0799PDKXW,https://www.amazon.com//Psycho-Bunny-Mens-Sunbleached-Black/dp/B0799PDKXW/ref=sr_1_172?dchild=1&keywords=hat&qid=1626700868&sr=8-172
EWAKCOT Adjustable One Size Working Cap with Sweatband Tie Back Hat Anime Printing Caps for Women Men,B08VH9MT42,https://www.amazon.com//gp/slredirect/picassoRedirect.html/ref=pa_sp_mtf_aps_sr_pg4_1?ie=UTF8&adId=A08762692VO9ONBAF4IQ8&url=%2FEWAKCOT-Fashion-Calabash-Multiple-Printing%2Fdp%2FB08VH9MT42%2Fref%3Dsr_1_173_sspa%3Fdchild%3D1%26keywords%3Dhat%26qid%3D1626700868%26sr%3D8-173-spons%26psc%3D1&qualifier=1626700868&id=1601064244581478&widgetName=sp_mtf
farlalah Kids’ UPF 50+ Wide Brim Neck Flap UV Sun Protection Hat Adjustable Summer Play Kids Sun Hat,B093VNG8GL,https://www.amazon.com//gp/slredirect/picassoRedirect.html/ref=pa_sp_mtf_aps_sr_pg4_1?ie=UTF8&adId=A01552822ASFPIBEJB8MQ&url=%2Ffarlalah-Protection-Adjustable-Summer-one_Size%2Fdp%2FB093VNG8GL%2Fref%3Dsr_1_174_sspa%3Fdchild%3D1%26keywords%3Dhat%26qid%3D1626700868%26sr%3D8-174-spons%26psc%3D1&qualifier=1626700868&id=1601064244581478&widgetName=sp_mtf
"Neon Sparkly Glitter Space Cowboy Hat - Fun Metallic Silver Holographic Party Disco Cowgirl Hat for Birthday & Bachelorette Parties, Halloween, Raves",B08SQLGFLJ,https://www.amazon.com//gp/slredirect/picassoRedirect.html/ref=pa_sp_mtf_aps_sr_pg4_1?ie=UTF8&adId=A00492273VYKZAWHP52W1&url=%2FNeon-Sparkly-Glitter-Space-Cowboy%2Fdp%2FB08SQLGFLJ%2Fref%3Dsr_1_175_sspa%3Fdchild%3D1%26keywords%3Dhat%26qid%3D1626700868%26sr%3D8-175-spons%26psc%3D1&qualifier=1626700868&id=1601064244581478&widgetName=sp_mtf
Billabong Men's Classic Trucker Hat,B075SX37ZJ,https://www.amazon.com//Billabong-Mens-Classic-Trucker-Heather/dp/B075SX37ZJ/ref=sr_1_176?dchild=1&keywords=hat&qid=1626700868&sr=8-176
Stetson Gambler Straw Cowboy Hat Wheat L/XL,B00BJOUEL6,https://www.amazon.com//Stetson-Gambler-Straw-Cowboy-Wheat/dp/B00BJOUEL6/ref=sr_1_177?dchild=1&keywords=hat&qid=1626700868&sr=8-177
adidas Men's Pennant Snapback Cap,B008THOU7K,https://www.amazon.com//adidas-Pennant-Snapback-Graphite-Black/dp/B008THOU7K/ref=sr_1_178?dchild=1&keywords=hat&qid=1626700868&sr=8-178
ARIAT Mexico Text Trucker Hat,B089DNR92G,https://www.amazon.com//ARIAT-Mexico-Text-Trucker-Hat/dp/B089DNR92G/ref=sr_1_179?dchild=1&keywords=hat&qid=1626700868&sr=8-179
Billabong Women's Tipton Sun Hat,B093ZRTGWN,https://www.amazon.com//Billabong-Womens-Tipton-Black-Army/dp/B093ZRTGWN/ref=sr_1_180?dchild=1&keywords=hat&qid=1626700868&sr=8-180
prAna Women's Jaden Trucker Hat,B00IQD6MVO,https://www.amazon.com//prAna-Living-Womens-Jaden-Trucker/dp/B00IQD6MVO/ref=sr_1_181?dchild=1&keywords=hat&qid=1626700868&sr=8-181
Columbia unisex-adult Mesh Ballcap,B08148KMSW,https://www.amazon.com//Columbia-Ballcap-Grill-Heather-X-Large/dp/B08148KMSW/ref=sr_1_182?dchild=1&keywords=hat&qid=1626700868&sr=8-182
Under Armour Men's Launch Run Hat,B089KK8NN3,https://www.amazon.com//Under-Armour-Launch-Pitch-Reflective/dp/B089KK8NN3/ref=sr_1_183?dchild=1&keywords=hat&qid=1626700868&sr=8-183
Roxy Women's Dear Believer Logo Cap,B07PPR1YTW,https://www.amazon.com//Roxy-Juniors-Dear-Believer-Anthracite/dp/B07PPR1YTW/ref=sr_1_184?dchild=1&keywords=hat&qid=1626700868&sr=8-184
Sunday Afternoons Emma Hat,B08WHW7F22,https://www.amazon.com//Sunday-Afternoons-Womens-Standard-Cornflower/dp/B08WHW7F22/ref=sr_1_185?dchild=1&keywords=hat&qid=1626700868&sr=8-185
"Rip Curl Men's Paradise Straw Lifeguard Sun Hat, Adjustable Straw Hat for Men",B08DZMQ6YD,https://www.amazon.com//Rip-Curl-Paradise-Straw-Lifeguard/dp/B08DZMQ6YD/ref=sr_1_186?dchild=1&keywords=hat&qid=1626700868&sr=8-186
HDE Trucker Hat - Performance Outdoor Snapback Adventure Hats for Men,B087D7Z84T,https://www.amazon.com//HDE-Trucker-Hat-Performance-Adventure/dp/B087D7Z84T/ref=sr_1_187?dchild=1&keywords=hat&qid=1626700868&sr=8-187
Under Armour Men's Fish Hook 2.0 Cap,B07CVSTTMS,https://www.amazon.com//Under-Armour-Outerwear-Hunter-Medium/dp/B07CVSTTMS/ref=sr_1_188?dchild=1&keywords=hat&qid=1626700868&sr=8-188
Roxy Women's Next Level Baseball Hat,B07SRK91P7,https://www.amazon.com//Roxy-ERJHA03690-Next-Level-Trucker/dp/B07SRK91P7/ref=sr_1_189?dchild=1&keywords=hat&qid=1626700868&sr=8-189
Nike Men's U NSW PRO Cap Futura,B072BXSD8Q,https://www.amazon.com//Futura-Snapback-Black-Green-891284-010/dp/B072BXSD8Q/ref=sr_1_190?dchild=1&keywords=hat&qid=1626700868&sr=8-190
San Diego Hat Company Women's Ultrabraid X Large Brim Hat,B0032AMW0G,https://www.amazon.com//San-Diego-Hat-Company-Size/dp/B0032AMW0G/ref=sr_1_191?dchild=1&keywords=hat&qid=1626700868&sr=8-191
adidas Women's Adizero Extra Cap,B00LU1DT88,https://www.amazon.com//adidas-Womens-adiZero-Granite-Heather/dp/B00LU1DT88/ref=sr_1_192?dchild=1&keywords=hat&qid=1626700868&sr=8-192
Billabong Men's Big John Safari Sun Protection Hat with Chin Strap,B07XMJNN5S,https://www.amazon.com//Billabong-Mens-John-Safari-Black/dp/B07XMJNN5S/ref=sr_1_193?dchild=1&keywords=hat&qid=1626700868&sr=8-193
adidas Men's Victory 3 Bucket Hat,B07RMBY4BL,https://www.amazon.com//adidas-Mens-Victory-Bucket-Black/dp/B07RMBY4BL/ref=sr_1_194?dchild=1&keywords=hat&qid=1626700868&sr=8-194
Roxy Beautiful Morning Trucker Hat,B086MP1WXT,https://www.amazon.com//Roxy-womens-Beautiful-Morning-Trucker/dp/B086MP1WXT/ref=sr_1_195?dchild=1&keywords=hat&qid=1626700868&sr=8-195
Nike Golf Dri-Fit Swoosh Front Cap White/Black,B01KIG8FA2,https://www.amazon.com//Nike-Golf-Dri-Fit-Swoosh-Front/dp/B01KIG8FA2/ref=sr_1_196?dchild=1&keywords=hat&qid=1626700868&sr=8-196
Chaos Edward Cadet Hat,B008737SHK,https://www.amazon.com//Chaos-Womens-Diesel-Cadet-Heather/dp/B008737SHK/ref=sr_1_197?dchild=1&keywords=hat&qid=1626700868&sr=8-197
ARIAT Men's Leather Logo Patch Flexfit Cap,B07MTLNTCK,https://www.amazon.com//ARIAT-Leather-Patch-Flexfit-Heather/dp/B07MTLNTCK/ref=sr_1_198?dchild=1&keywords=hat&qid=1626700868&sr=8-198
"San Diego Hat Co. Men's Straw Lifeguard Hat with Adjustabel Chin Cord, Natural/Black, One Size",B01DAD5C7E,https://www.amazon.com//San-Diego-Hat-Lifeguard-Adjustabel/dp/B01DAD5C7E/ref=sr_1_199?dchild=1&keywords=hat&qid=1626700868&sr=8-199
Ruth&Boaz Unisex Stone Washed 100% Cotton Bucket Hat Travel Hat,B08FLGTV6X,https://www.amazon.com//gp/slredirect/picassoRedirect.html/ref=pa_sp_btf_aps_sr_pg4_1?ie=UTF8&adId=A09208522YH0J1S986NVI&url=%2FRuth-Boaz-Unisex-Washed-Cotton%2Fdp%2FB08FLGTV6X%2Fref%3Dsr_1_200_sspa%3Fdchild%3D1%26keywords%3Dhat%26qid%3D1626700868%26sr%3D8-200-spons%26psc%3D1&qualifier=1626700868&id=1601064244581478&widgetName=sp_btf
Buffalo Soldiers Hat,B08Y69H8M4,https://www.amazon.com//gp/slredirect/picassoRedirect.html/ref=pa_sp_btf_aps_sr_pg4_1?ie=UTF8&adId=A09767193C853M2ICI1TZ&url=%2FBuffalo-Soldiers-Camo-Mesh-Trucker%2Fdp%2FB08Y69H8M4%2Fref%3Dsr_1_201_sspa%3Fdchild%3D1%26keywords%3Dhat%26qid%3D1626700868%26sr%3D8-201-spons%26psc%3D1&qualifier=1626700868&id=1601064244581478&widgetName=sp_btf
KOOLSOLY Breathable Wide Brim Boonie Hat Outdoor Waterproof UPF 50+ Sun Protection Mesh Safari Sun hat for Travel Fishing,B07TJR2KJ9,https://www.amazon.com//gp/slredirect/picassoRedirect.html/ref=pa_sp_atf_next_aps_sr_pg5_1?ie=UTF8&adId=A00967521HUUX9U1X5ZVT&url=%2FKOOLSOLY-Breathable-Outdoor-Waterproof-Protection%2Fdp%2FB07TJR2KJ9%2Fref%3Dsr_1_193_sspa%3Fdchild%3D1%26keywords%3Dhat%26qid%3D1626700872%26sr%3D8-193-spons%26psc%3D1&qualifier=1626700872&id=6300974702595735&widgetName=sp_atf_next
Lenikis Unisex Outdoor Activities UV Protecting Sun Hats with Neck Flap,B011G9Y34C,https://www.amazon.com//gp/slredirect/picassoRedirect.html/ref=pa_sp_atf_next_aps_sr_pg5_1?ie=UTF8&adId=A028211921RIVKHN43FWE&url=%2FLenikis-Unisex-Outdoor-Activities-Protecting%2Fdp%2FB011G9Y34C%2Fref%3Dsr_1_194_sspa%3Fdchild%3D1%26keywords%3Dhat%26qid%3D1626700872%26sr%3D8-194-spons%26psc%3D1&qualifier=1626700872&id=6300974702595735&widgetName=sp_atf_next
LINDO Trucker Hat - The Great Outdoors 2.0,B08FCPTP25,https://www.amazon.com//gp/slredirect/picassoRedirect.html/ref=pa_sp_atf_next_aps_sr_pg5_1?ie=UTF8&adId=A06187061OMXSOP2M06PK&url=%2FLINDO-Trucker-Hat-Great-Outdoors%2Fdp%2FB08FCPTP25%2Fref%3Dsr_1_195_sspa%3Fdchild%3D1%26keywords%3Dhat%26qid%3D1626700872%26sr%3D8-195-spons%26psc%3D1&qualifier=1626700872&id=6300974702595735&widgetName=sp_atf_next
VR46 Quarantasei Cap Black line Special Edition Valentino Rossi Located in The USA,B0867Y7SZS,https://www.amazon.com//gp/slredirect/picassoRedirect.html/ref=pa_sp_atf_next_aps_sr_pg5_1?ie=UTF8&adId=A0430841YDPD94MBKN27&url=%2FVR46-Quarantasei-Special-Valentino-Located%2Fdp%2FB0867Y7SZS%2Fref%3Dsr_1_196_sspa%3Fdchild%3D1%26keywords%3Dhat%26qid%3D1626700872%26sr%3D8-196-spons%26psc%3D1&qualifier=1626700872&id=6300974702595735&widgetName=sp_atf_next
Roxy Womens Roxy Incognito Trucker Hat For Women Erjha03614,B07R7BCMZ4,https://www.amazon.com//Roxy-Juniors-Incognito-Cap-Marshmallow/dp/B07R7BCMZ4/ref=sr_1_197?dchild=1&keywords=hat&qid=1626700872&sr=8-197
"2PCS Wide Brim Sun Visor Hat Women Large UV Protective Golf Beach Cap, Korea Design",B08VFP1BQL,https://www.amazon.com//Visor-Women-Large-Protective-Design/dp/B08VFP1BQL/ref=sr_1_198?dchild=1&keywords=hat&qid=1626700872&sr=8-198
RVCA Men's Curved Bill Snapback Mesh Trucker Hat,B07XPS9SL7,https://www.amazon.com//RVCA-Mens-Curve-Bill-Heather/dp/B07XPS9SL7/ref=sr_1_199?dchild=1&keywords=hat&qid=1626700872&sr=8-199
RVCA Men's Adjustable Snapback Mesh Trucker Hat,B07L62WCHW,https://www.amazon.com//RVCA-Mens-MESH-Trucker-Charcoal/dp/B07L62WCHW/ref=sr_1_200?dchild=1&keywords=hat&qid=1626700872&sr=8-200
"ARIAT Women's Serape Cactus Mesh Snap Cap, White/Blue, One Size",B076H5W8VY,https://www.amazon.com//ARIAT-Womens-Serape-Cactus-White/dp/B076H5W8VY/ref=sr_1_201?dchild=1&keywords=hat&qid=1626700872&sr=8-201
adidas Women's Adizero Sequence Cap,B006RK3FLS,https://www.amazon.com//adidas-Womens-Adizero-Sequence-Cap/dp/B006RK3FLS/ref=sr_1_202?dchild=1&keywords=hat&qid=1626700872&sr=8-202
Brixton Men's Rival Medium Profile Adjustable Snapback Hat,B00I3S7T2S,https://www.amazon.com//Brixton-Medium-Profile-Adjustable-Snapback/dp/B00I3S7T2S/ref=sr_1_203?dchild=1&keywords=hat&qid=1626700872&sr=8-203
Lacoste Men's Big Croc Twill Adjustable Leather Strap Hat,B07SY43Z6H,https://www.amazon.com//Lacoste-Twill-Adjustable-Leather-Strap/dp/B07SY43Z6H/ref=sr_1_204?dchild=1&keywords=hat&qid=1626700872&sr=8-204
"Concept One Disney's Pixar Monsters University Cotton Adjustable Baseball Hat with Curved Brim, Blue, One Size",B07RLRFJXL,https://www.amazon.com//Disney-Monsters-University-Adjustable-Snapback/dp/B07RLRFJXL/ref=sr_1_205?dchild=1&keywords=hat&qid=1626700872&sr=8-205
Lacoste Men's Sport Gabardine and Mesh Tennis Cap,B009PO07A0,https://www.amazon.com//Lacoste-Sport-Gabardine-Tennis-White/dp/B009PO07A0/ref=sr_1_206?dchild=1&keywords=hat&qid=1626700872&sr=8-206
Under Armour Men's Printed Blitzing 3.0 Stretch Fit Cap,B07PXTS8K6,https://www.amazon.com//Under-Armour-Printed-Blitzing-Stretch/dp/B07PXTS8K6/ref=sr_1_207?dchild=1&keywords=hat&qid=1626700872&sr=8-207
RVCA Men's Adjustable Snapback Hat,B012PJK5SA,https://www.amazon.com//RVCA-Commonwealth-Snapback-Black-White/dp/B012PJK5SA/ref=sr_1_208?dchild=1&keywords=hat&qid=1626700872&sr=8-208
Quiksilver Men's Jettyside Hat,B07RZZBG55,https://www.amazon.com//QUIKSILVER-Mens-JETTYSIDE-HAT-Natural/dp/B07RZZBG55/ref=sr_1_209?dchild=1&keywords=hat&qid=1626700872&sr=8-209
Sunday Afternoons Women's Sol Seeker,B01J5J0EUC,https://www.amazon.com//Sunday-Afternoons-Womens-Seeker-Agate/dp/B01J5J0EUC/ref=sr_1_210?dchild=1&keywords=hat&qid=1626700872&sr=8-210
Under Armour Men's Blitzing Trucker,B08NWHFR5W,https://www.amazon.com//Under-Armour-Blitzing-Trucker-Black/dp/B08NWHFR5W/ref=sr_1_211?dchild=1&keywords=hat&qid=1626700872&sr=8-211
Life is Good Sunwashed Chill Cap Baseball Hat Collection,B077SXYMCS,https://www.amazon.com//Life-Good-Unisex-Sunwashed-Outdoor/dp/B077SXYMCS/ref=sr_1_212?dchild=1&keywords=hat&qid=1626700872&sr=8-212
Flexfit Ultrafibre Airmesh Fitted Cap,B073DXK41Z,https://www.amazon.com//Flexfit-6533-Ultrafibre-Airmesh-Fitted/dp/B073DXK41Z/ref=sr_1_213?dchild=1&keywords=hat&qid=1626700872&sr=8-213
The Hat Depot Unisex Blank Washed Low Profile Cotton Dad Hat Baseball Cap,B01ENQ4HX2,https://www.amazon.com//HAT-DEPOT-Washed-Profile-Baseball/dp/B01ENQ4HX2/ref=sr_1_214?dchild=1&keywords=hat&qid=1626700872&sr=8-214
Roxy Finishline Hat,B07STLWWNP,https://www.amazon.com//Roxy-Juniors-Finishline-Trucker-Anthracite/dp/B07STLWWNP/ref=sr_1_215?dchild=1&keywords=hat&qid=1626700872&sr=8-215
adidas Men's Closer Stretch Cap,B0072UPR40,https://www.amazon.com//adidas-Closer-Stretch-Collegiate-XX-Large/dp/B0072UPR40/ref=sr_1_216?dchild=1&keywords=hat&qid=1626700872&sr=8-216
"Lightbird 3PCS Baseball Caps & Cute Embroidery Patches Bundle, Make Your Different Dad Hats, Low Prolife, Washed Cotton",B08V8GXGB3,https://www.amazon.com//Lightbird-Baseball-Embroidery-Patches-Different/dp/B08V8GXGB3/ref=sr_1_217?dchild=1&keywords=hat&qid=1626700872&sr=8-217
C.C Exclusives Washed Distressed Cotton Denim Criss-Cross Ponytail Hat Baseball Cap Bundle Hair Tie (BT-780)(BT-791),B083QPNZV3,https://www.amazon.com//C-C-Exclusives-Hatsandscarf-Distressed-Adjustable/dp/B083QPNZV3/ref=sr_1_218?dchild=1&keywords=hat&qid=1626700872&sr=8-218
Caterpillar Men's Raised Logo Cap,B07CKJL6B7,https://www.amazon.com//Caterpillar-Mens-Raised-Logo-Black/dp/B07CKJL6B7/ref=sr_1_219?dchild=1&keywords=hat&qid=1626700872&sr=8-219
Flexfit Men's Cool & Dry Sport,B07P43V9NY,https://www.amazon.com//Flexfit-Mens-Sport-Black-X-Large/dp/B07P43V9NY/ref=sr_1_220?dchild=1&keywords=hat&qid=1626700872&sr=8-220
EWAKCOT Adjustable One Size Working Cap with Sweatband Tie Back Hat Anime Printing Caps for Women Men,B08VHCSBN9,https://www.amazon.com//gp/slredirect/picassoRedirect.html/ref=pa_sp_mtf_aps_sr_pg5_1?ie=UTF8&adId=A08761451WA8HKJXSN4T4&url=%2FEWAKCOT-Fashion-Calabash-Multiple-Printing%2Fdp%2FB08VHCSBN9%2Fref%3Dsr_1_221_sspa%3Fdchild%3D1%26keywords%3Dhat%26qid%3D1626700872%26sr%3D8-221-spons%26psc%3D1&qualifier=1626700872&id=6300974702595735&widgetName=sp_mtf
farlalah Kids’ UPF 50+ Wide Brim Neck Flap UV Sun Protection Hat Adjustable Summer Play Kids Sun Hat,B093VPDQJS,https://www.amazon.com//gp/slredirect/picassoRedirect.html/ref=pa_sp_mtf_aps_sr_pg5_1?ie=UTF8&adId=A01554062EUG4DL2TKMD2&url=%2Ffarlalah-Protection-Adjustable-Summer-one_Size%2Fdp%2FB093VPDQJS%2Fref%3Dsr_1_222_sspa%3Fdchild%3D1%26keywords%3Dhat%26qid%3D1626700872%26sr%3D8-222-spons%26psc%3D1&qualifier=1626700872&id=6300974702595735&widgetName=sp_mtf
Peter Grimm Mens Straw Round Up Cowboy Hat,B016R4AOKS,https://www.amazon.com//gp/slredirect/picassoRedirect.html/ref=pa_sp_mtf_aps_sr_pg5_1?ie=UTF8&adId=A05582452893FZQBBCOAQ&url=%2FPeter-Grimm-Cowboy-Leather-Stained%2Fdp%2FB016R4AOKS%2Fref%3Dsr_1_223_sspa%3Fdchild%3D1%26keywords%3Dhat%26qid%3D1626700872%26sr%3D8-223-spons%26psc%3D1&qualifier=1626700872&id=6300974702595735&widgetName=sp_mtf
Tommy Hilfiger Men's Ardin Dad Hat,B076K81QZR,https://www.amazon.com//Tommy-Hilfiger-Mens-Ardin-White/dp/B076K81QZR/ref=sr_1_224?dchild=1&keywords=hat&qid=1626700872&sr=8-224
ARIAT Men's Black Blue Half Mesh Hat,B00IIV9OQY,https://www.amazon.com//ARIAT-Mens-Black-Large-X-Large/dp/B00IIV9OQY/ref=sr_1_225?dchild=1&keywords=hat&qid=1626700872&sr=8-225
"ARIAT Men's Shield Flag Center Patch Mesh Cap, Blue, One Size",B078TC45TW,https://www.amazon.com//Ariat-Mens-Shield-Center-Patch/dp/B078TC45TW/ref=sr_1_226?dchild=1&keywords=hat&qid=1626700872&sr=8-226
John Deere NCAA mens Vintage Logo Cap,B00JELACCW,https://www.amazon.com//John-Deere-Embroidered-Vintage-Baseball/dp/B00JELACCW/ref=sr_1_227?dchild=1&keywords=hat&qid=1626700872&sr=8-227
Roxy Women's Soulrocker Trucker Hat,B08MTJQSGT,https://www.amazon.com//Roxy-Women-Soulrocker-Trucker-Hat/dp/B08MTJQSGT/ref=sr_1_228?dchild=1&keywords=hat&qid=1626700872&sr=8-228
Columbia Women's Silver Ridge Ball Cap,B0034OE726,https://www.amazon.com//Columbia-Womens-Titanium-Silver-Ridge/dp/B0034OE726/ref=sr_1_229?dchild=1&keywords=hat&qid=1626700872&sr=8-229
adidas Men's Superlite Relaxed Adjustable Performance Cap,B0883MB3LV,https://www.amazon.com//adidas-Superlite-Adjustable-Performance-Reflective/dp/B0883MB3LV/ref=sr_1_230?dchild=1&keywords=hat&qid=1626700872&sr=8-230
"San Diego Hat Co. Men's Upf 50 Wide Brim Straw Lifeguard Outback Sun, Natural, One Size",B01DAD5CAQ,https://www.amazon.com//San-Diego-Hat-Lifeguard-Outback/dp/B01DAD5CAQ/ref=sr_1_231?dchild=1&keywords=hat&qid=1626700872&sr=8-231
HUK Men's Huk'd Up Angler Anti-Glare Fishing Hat,B08BLST7TR,https://www.amazon.com//HUK-Angler-Anti-Glare-Fishing-Blackwater/dp/B08BLST7TR/ref=sr_1_232?dchild=1&keywords=hat&qid=1626700872&sr=8-232
"Ouray Sportswear Digital Camo Cap, Digital Grey/Sand, Adjustable",B07D2WNGFR,https://www.amazon.com//Ouray-Sportswear-Digital-Camo-Adjustable/dp/B07D2WNGFR/ref=sr_1_233?dchild=1&keywords=hat&qid=1626700872&sr=8-233
ARIAT Women's Cactus Logo Snapback Cap,B078TBTHNH,https://www.amazon.com//ARIAT-Womens-Offset-Cactus-Mesh/dp/B078TBTHNH/ref=sr_1_234?dchild=1&keywords=hat&qid=1626700872&sr=8-234
ARIAT Men's Solid Black Corner Logo,B01EU1LOWC,https://www.amazon.com//Ariat-Mens-Solid-Black-Corner/dp/B01EU1LOWC/ref=sr_1_235?dchild=1&keywords=hat&qid=1626700872&sr=8-235
Quiksilver Men's Outsider Lifeguard Beach Sun Straw Hat,B07WDVZKLL,https://www.amazon.com//Quiksilver-Outsider-Merica-Protection-Natural/dp/B07WDVZKLL/ref=sr_1_236?dchild=1&keywords=hat&qid=1626700872&sr=8-236
Champion Embroidered Logo Bucket Hat,B08M8Z11TF,https://www.amazon.com//Champion-Mens-Bucket-Black-Size/dp/B08M8Z11TF/ref=sr_1_237?dchild=1&keywords=hat&qid=1626700872&sr=8-237
adidas Men's Riot Snapback Flat Brim Cap,B00LU1CWJK,https://www.amazon.com//adidas-Snapback-Bright-Collegiate-Orange/dp/B00LU1CWJK/ref=sr_1_238?dchild=1&keywords=hat&qid=1626700872&sr=8-238
