Description,ASIN,Product URL
SWINGJUICE.COM unisex-adult Flat,B0959JKD4Q,https://www.amazon.com//gp/slredirect/picassoRedirect.html/ref=pa_sp_atf_next_aps_sr_pg2_1?ie=UTF8&adId=A09042141IXFJC4YK80EP&url=%2FSwingJuice-Retro-Adjustable-Snapback-Trucker%2Fdp%2FB0959JKD4Q%2Fref%3Dsr_1_49_sspa%3Fdchild%3D1%26keywords%3Dhat%26qid%3D1626700861%26sr%3D8-49-spons%26psc%3D1&qualifier=1626700861&id=2464153922601767&widgetName=sp_atf_next
Eisbär Jamies Headband,B01LXIZHRC,https://www.amazon.com//gp/slredirect/picassoRedirect.html/ref=pa_sp_atf_next_aps_sr_pg2_1?ie=UTF8&adId=A07937102RS20ACOXFAH7&url=%2FEisb%25C3%25A4r-Jamies-Headband-Azure-Blue%2Fdp%2FB01LXIZHRC%2Fref%3Dsr_1_50_sspa%3Fdchild%3D1%26keywords%3Dhat%26qid%3D1626700861%26sr%3D8-50-spons%26psc%3D1&qualifier=1626700861&id=2464153922601767&widgetName=sp_atf_next
Eisbär Cocker,B004WR1L1O,https://www.amazon.com//gp/slredirect/picassoRedirect.html/ref=pa_sp_atf_next_aps_sr_pg2_1?ie=UTF8&adId=A04458351ZDZSOHTQ498M&url=%2FEisb%25C3%25A4r-Bonnet-Homme-grafit-rougemele%2Fdp%2FB004WR1L1O%2Fref%3Dsr_1_51_sspa%3Fdchild%3D1%26keywords%3Dhat%26qid%3D1626700861%26sr%3D8-51-spons%26psc%3D1&qualifier=1626700861&id=2464153922601767&widgetName=sp_atf_next
Neon Sparkly Glitter Space Cowboy Hat - Fun Metallic Holographic Party Disco Cowgirl Hat,B08SQ89KYN,https://www.amazon.com//gp/slredirect/picassoRedirect.html/ref=pa_sp_atf_next_aps_sr_pg2_1?ie=UTF8&adId=A005713923LVWPB64I93J&url=%2FNeon-Sparkly-Glitter-Space-Cowboy%2Fdp%2FB08SQ89KYN%2Fref%3Dsr_1_52_sspa%3Fdchild%3D1%26keywords%3Dhat%26qid%3D1626700861%26sr%3D8-52-spons%26psc%3D1&qualifier=1626700861&id=2464153922601767&widgetName=sp_atf_next
Billabong Men's Tides Straw Hat,B07ZJMM7KY,https://www.amazon.com//Billabong-Tides-Natural-One-Size/dp/B07ZJMM7KY/ref=sr_1_53?dchild=1&keywords=hat&qid=1626700861&sr=8-53
Hurley Men's Phantom Vagabond Elite Bucket Sun Hat,B07ZPRX3KX,https://www.amazon.com//Hurley-Phantom-Vagabond-Elite-Bucket/dp/B07ZPRX3KX/ref=sr_1_54?dchild=1&keywords=hat&qid=1626700861&sr=8-54
"Flexfit mens Flexfit Delta Seamless Cap Hat, Black, Large-X-Large US",B073DYFDP3,https://www.amazon.com//Flexfit-Seamless-Fitted-Delta-Black/dp/B073DYFDP3/ref=sr_1_55?dchild=1&keywords=hat&qid=1626700861&sr=8-55
Home Prefer Outdoor UPF50+ Mesh Sun Hat Wide Brim Fishing Hat with Neck Flap,B07CPYB2PR,https://www.amazon.com//Home-Prefer-Foldable-Fishing-Protection/dp/B07CPYB2PR/ref=sr_1_56?dchild=1&keywords=hat&qid=1626700861&sr=8-56
Lanzom Women Wide Brim Straw Panama Roll up Hat Fedora Beach Sun Hat UPF50+,B06XYYS12C,https://www.amazon.com//Lanzom-Women-Straw-Panama-Fedora/dp/B06XYYS12C/ref=sr_1_57?dchild=1&keywords=hat&qid=1626700861&sr=8-57
ARIAT Embroidered Shield Flexfit Cap,B078TC68ZD,https://www.amazon.com//Ariat-Mens-Gray-Heather-Black/dp/B078TC68ZD/ref=sr_1_58?dchild=1&keywords=hat&qid=1626700861&sr=8-58
Columbia Unisex-Adult PFG Snap Back Fish Flag Ballcap,B07DKZWC87,https://www.amazon.com//Columbia-Unisex-Mesh-Titanium-White/dp/B07DKZWC87/ref=sr_1_59?dchild=1&keywords=hat&qid=1626700861&sr=8-59
Naicissism Fishing Men's Trucker Hat Mesh Cap - One Size Fits All Snapback Closure - Great for Hunting & Fishing,B08FT4MZX4,https://www.amazon.com//Naicissism-Fishing-Mens-Trucker-Mesh/dp/B08FT4MZX4/ref=sr_1_60?dchild=1&keywords=hat&qid=1626700861&sr=8-60
"Gaiam Women's Hat-Breathable Ball Cap, Pre-Shaped Bill, Adjustable Size for Running",B08118GM75,https://www.amazon.com//Gaiam-Running-Hat-Women-Men/dp/B08118GM75/ref=sr_1_61?dchild=1&keywords=hat&qid=1626700861&sr=8-61
'47 Brand MLB LA Dodgers Clean Up Cap - Black,B01H5Y7K60,https://www.amazon.com//47-Brand-MLB-Dodgers-Clean/dp/B01H5Y7K60/ref=sr_1_62?dchild=1&keywords=hat&qid=1626700861&sr=8-62
Home Prefer Mens UPF 50+ Sun Protection Cap Wide Brim Fishing Hat with Neck Flap,B01CAGGL3G,https://www.amazon.com//Home-Prefer-Adult-Protection-Fishing/dp/B01CAGGL3G/ref=sr_1_63?dchild=1&keywords=hat&qid=1626700861&sr=8-63
New Era Los Angeles Dodgers Adjustable 9Fifty MLB Straight Brim Baseball Cap 950,B07CZ3DTP1,https://www.amazon.com//New-Era-Angeles-Dodgers-Snapback/dp/B07CZ3DTP1/ref=sr_1_64?dchild=1&keywords=hat&qid=1626700861&sr=8-64
PUMA Women's Evercat Opal Adjustable Cap,B082LN5RBC,https://www.amazon.com//PUMA-Womens-Baseball-Cap-Black/dp/B082LN5RBC/ref=sr_1_65?dchild=1&keywords=hat&qid=1626700861&sr=8-65
Bucket Hats for Women Sun Beach Hat Teens Girls Wide Brim Summer Fisherman's Caps UPF 50+,B07CPSQWYQ,https://www.amazon.com//Bucket-Cotton-Summer-Foldable-B2-ivory/dp/B07CPSQWYQ/ref=sr_1_66?dchild=1&keywords=hat&qid=1626700861&sr=8-66
Under Armour Men's Armour Twist Stretch Cap,B07PS723YY,https://www.amazon.com//Under-Armour-Stretch-Heather-XX-Large/dp/B07PS723YY/ref=sr_1_67?dchild=1&keywords=hat&qid=1626700861&sr=8-67
John Deere NCAA Mens Logo Contrast Mesh Back Core Baseball Cap,B00BFRZIPO,https://www.amazon.com//John-Deere-Embroidered-Logo-Baseball/dp/B00BFRZIPO/ref=sr_1_68?dchild=1&keywords=hat&qid=1626700861&sr=8-68
Funky Junque Criss Cross Hat Womens Baseball Cap Distressed Ponytail Messy Bun Trucker Ponycap,B08666RHN6,https://www.amazon.com//Funky-Junque-H-216-780-06-Ponytail-Distressed/dp/B08666RHN6/ref=sr_1_69?dchild=1&keywords=hat&qid=1626700861&sr=8-69
Callaway Golf 2020 Sun Hat,B07YVTLK76,https://www.amazon.com//Callaway-Golf-2020-Sun-Hat/dp/B07YVTLK76/ref=sr_1_70?dchild=1&keywords=hat&qid=1626700861&sr=8-70
LCZTN UPF 50+ Sun Protection Cap Wide Brim Fishing Hat with Face & Neck Flap,B07FPNLX3J,https://www.amazon.com//LCZTN-Protection-Breathable-Removable-Boating%EF%BC%88Dark/dp/B07FPNLX3J/ref=sr_1_71?dchild=1&keywords=hat&qid=1626700861&sr=8-71
Quiksilver Men's Easy Does It Snap Back Trucker Hat,B07RZWRLGX,https://www.amazon.com//Quiksilver-Mens-Easy-Does-Camo/dp/B07RZWRLGX/ref=sr_1_72?dchild=1&keywords=hat&qid=1626700861&sr=8-72
San Diego Hat Company Women's Ultrabraid Visor Hat,B00283OKZ8,https://www.amazon.com//San-Diego-Hat-Company-Ultrabraid/dp/B00283OKZ8/ref=sr_1_73?dchild=1&keywords=hat&qid=1626700861&sr=8-73
adidas Originals Men's Trefoil Chain Flatbrim Snapback Cap,B00U14RDBE,https://www.amazon.com//adidas-originals-snapback-flatbrim-Black/dp/B00U14RDBE/ref=sr_1_74?dchild=1&keywords=hat&qid=1626700861&sr=8-74
Kimes Ranch Men's Weekly Trucker Cap,B0727S5JX8,https://www.amazon.com//Kimes-Ranch-Weekly-Trucker-Hat/dp/B0727S5JX8/ref=sr_1_75?dchild=1&keywords=hat&qid=1626700861&sr=8-75
Riot Society Mens Embroidered Adjustable Dad Hat,B07KJP3HMP,https://www.amazon.com//Riot-Society-Rose-Embroidered-Dad/dp/B07KJP3HMP/ref=sr_1_76?dchild=1&keywords=hat&qid=1626700861&sr=8-76
Ted & Jack - Street Easy Herringbone or Plaid Driving Cap with Quilted Lining,B0764J5P1K,https://www.amazon.com//gp/slredirect/picassoRedirect.html/ref=pa_sp_mtf_aps_sr_pg2_1?ie=UTF8&adId=A02269518OVH7UVC074Q&url=%2FTed-Jack-Herringbone-Driving-Quilted%2Fdp%2FB0764J5P1K%2Fref%3Dsr_1_77_sspa%3Fdchild%3D1%26keywords%3Dhat%26qid%3D1626700861%26sr%3D8-77-spons%26psc%3D1&qualifier=1626700861&id=2464153922601767&widgetName=sp_mtf
"HolYudaica Pack of 10-Pcs - Hq 19/20CM Satin Kippah for Men & Boys, Yamaka Hat from Israel - Kippot Bulk",B07ZQR6FXZ,https://www.amazon.com//gp/slredirect/picassoRedirect.html/ref=pa_sp_mtf_aps_sr_pg2_1?ie=UTF8&adId=A00979942BTZVZZNXP0XY&url=%2FHolYudaica-Pack-10-Pcs-Kippah-Yamaka%2Fdp%2FB07ZQR6FXZ%2Fref%3Dsr_1_78_sspa%3Fdchild%3D1%26keywords%3Dhat%26qid%3D1626700861%26sr%3D8-78-spons%26psc%3D1&qualifier=1626700861&id=2464153922601767&widgetName=sp_mtf
Ruth&Boaz Unisex Stone Washed 100% Cotton Bucket Hat Travel Hat,B08FM7BV1D,https://www.amazon.com//gp/slredirect/picassoRedirect.html/ref=pa_sp_mtf_aps_sr_pg2_1?ie=UTF8&adId=A09207961WP1N3NF5XS7V&url=%2FRuth-Boaz-Unisex-Washed-Cotton%2Fdp%2FB08FM7BV1D%2Fref%3Dsr_1_79_sspa%3Fdchild%3D1%26keywords%3Dhat%26qid%3D1626700861%26sr%3D8-79-spons%26psc%3D1&qualifier=1626700861&id=2464153922601767&widgetName=sp_mtf
"prAna Embroidered Trucker Cap, Brown, One Size",B002O3Y2PA,https://www.amazon.com//prAna-Embroidered-Trucker-Brown-Size/dp/B002O3Y2PA/ref=sr_1_80?dchild=1&keywords=hat&qid=1626700861&sr=8-80
'47 Los Angeles Dodgers White Clean Up Dad Hat Adjustable Slouch Cap,B07XCHB6FM,https://www.amazon.com//47-Angeles-Dodgers-Adjustable-Slouch/dp/B07XCHB6FM/ref=sr_1_81?dchild=1&keywords=hat&qid=1626700861&sr=8-81
Los Angeles Dodgers Cleanup Adjustable Hat by '47 Brand,B0014GM8KY,https://www.amazon.com//Angeles-Dodgers-Cleanup-Adjustable-47/dp/B0014GM8KY/ref=sr_1_82?dchild=1&keywords=hat&qid=1626700861&sr=8-82
Hurley One & Only Men's Hat,B07KBDVBYS,https://www.amazon.com//Hurley-Mens-Only-Black-White/dp/B07KBDVBYS/ref=sr_1_83?dchild=1&keywords=hat&qid=1626700861&sr=8-83
The Hat Depot 300N Unisex 100% Cotton Packable Summer Travel Bucket Beach Sun Hat,B014V0DUME,https://www.amazon.com//Hat-Depot-Unisex-Cotton-Packable/dp/B014V0DUME/ref=sr_1_84?dchild=1&keywords=hat&qid=1626700861&sr=8-84
Women's Sun Hat Packable Reversible Bucket Hat UV Sun Protection Wide Brim Summer Beach Cap,B08XM9C3KJ,https://www.amazon.com//Womens-Packable-Reversible-Bucket-Protection/dp/B08XM9C3KJ/ref=sr_1_85?dchild=1&keywords=hat&qid=1626700861&sr=8-85
Hurley Men's One & Only Corp Flexfit Perma Curve Bill Baseball Hat,B076LD3TQK,https://www.amazon.com//Hurley-Flexfit-Perma-Curve-Baseball/dp/B076LD3TQK/ref=sr_1_86?dchild=1&keywords=hat&qid=1626700861&sr=8-86
Verabella Women's Lightweight Foldable/Packable Beach Sun Hat w/Decorative Bow,B079VYQYKG,https://www.amazon.com//Verabella-Lightweight-Womens-Foldable-Packable/dp/B079VYQYKG/ref=sr_1_87?dchild=1&keywords=hat&qid=1626700861&sr=8-87
adidas Men's Decision Cap,B076QNVT6S,https://www.amazon.com//adidas-Decision-Structured-Adjustable-White/dp/B076QNVT6S/ref=sr_1_88?dchild=1&keywords=hat&qid=1626700861&sr=8-88
Under Armour Men's Iso-chill ArmourVent Fitted Baseball Cap,B089KKJFBH,https://www.amazon.com//Under-Armour-Iso-Chill-Armourvent-Baseball/dp/B089KKJFBH/ref=sr_1_89?dchild=1&keywords=hat&qid=1626700861&sr=8-89
Women's Foldable Floppy Reversible Travel Beach Sun Visor Hat Wide Brim UPF 50+,B013BFWHJM,https://www.amazon.com//Womens-Foldable-Floppy-Reversible-Travel/dp/B013BFWHJM/ref=sr_1_90?dchild=1&keywords=hat&qid=1626700861&sr=8-90
"adidas Originals Women's Relaxed Tie Dye Strapback Cap, Black/White, ONE SIZE",B07D9HXXKB,https://www.amazon.com//adidas-Originals-Relaxed-Adjustable-Strapback/dp/B07D9HXXKB/ref=sr_1_91?dchild=1&keywords=hat&qid=1626700861&sr=8-91
"3pcs Foldable Wide Brim Straw Hats Sun Visors for Women, Bow Beach Hat Summer",B08ZYQP5JN,https://www.amazon.com//Foldable-Straw-Visors-Women-Summer/dp/B08ZYQP5JN/ref=sr_1_92?dchild=1&keywords=hat&qid=1626700861&sr=8-92
Under Armour Men's Curved Brim Stretch Fit Hat,B01FERRP6U,https://www.amazon.com//Under-Armour-Stretch-Graphite-X-Large/dp/B01FERRP6U/ref=sr_1_93?dchild=1&keywords=hat&qid=1626700861&sr=8-93
Home Prefer Men's Sun Hat UPF 50+ Wide Brim Bucket Hat Windproof Fishing Hats,B01CR650UO,https://www.amazon.com//Home-Prefer-Outdoor-Camouflage-Fishing/dp/B01CR650UO/ref=sr_1_94?dchild=1&keywords=hat&qid=1626700861&sr=8-94
2021 Flatbill Trucker Hat,B08SCGGTSQ,https://www.amazon.com//2021-Flatbill-Trucker-Hat-Navy/dp/B08SCGGTSQ/ref=sr_1_95?dchild=1&keywords=hat&qid=1626700861&sr=8-95
John Deere NCAA mens Logo Mesh Back Core Baseball Cap,B079F5W7XP,https://www.amazon.com//John-Deere-Service-Equipment-Snapback/dp/B079F5W7XP/ref=sr_1_96?dchild=1&keywords=hat&qid=1626700861&sr=8-96
Under Armour Adult Run Shadow Cap,B07RJYWD2B,https://www.amazon.com//Under-Armour-Shadow-Black-Size/dp/B07RJYWD2B/ref=sr_1_97?dchild=1&keywords=hat&qid=1626700861&sr=8-97
"Vineyard Vines Men's Classic Whale Logo Baseball Hat, Light Blue, ONE Size",B084LLWSL6,https://www.amazon.com//Vineyard-Vines-Classic-Whale-Baseball/dp/B084LLWSL6/ref=sr_1_98?dchild=1&keywords=hat&qid=1626700861&sr=8-98
O'NEILL Men's Bucket Hat,B08L497C2B,https://www.amazon.com//ONEILL-Mens-Headwear-Graphite-Wetlands/dp/B08L497C2B/ref=sr_1_99?dchild=1&keywords=hat&qid=1626700861&sr=8-99
Women Sun Bucket Hat Cotton Hats Teens Girls Wide Brim Floppy Summer Beach Caps UPF 50+,B08XBG9Y7Z,https://www.amazon.com//Women-Bucket-Cotton-Floppy-Summer/dp/B08XBG9Y7Z/ref=sr_1_100?dchild=1&keywords=hat&qid=1626700861&sr=8-100
melin Trenches Icon Hydro,B085RQGH74,https://www.amazon.com//melin-Trenches-Icon-Hydro-Navy/dp/B085RQGH74/ref=sr_1_101?dchild=1&keywords=hat&qid=1626700861&sr=8-101
adidas Youth Kids-Boy's/Girl's / Superlite Relaxed Adjustable Performance Cap,B079TQ5WDY,https://www.amazon.com//adidas-Superlite-Relaxed-Adjustable-Performance/dp/B079TQ5WDY/ref=sr_1_102?dchild=1&keywords=hat&qid=1626700861&sr=8-102
adidas Mens Amplifier Stretch Fit Structured Cap,B01MSP0AVK,https://www.amazon.com//adidas-Amplifier-Stretch-Structured-Medium/dp/B01MSP0AVK/ref=sr_1_103?dchild=1&keywords=hat&qid=1626700861&sr=8-103
EWAKCOT Adjustable One Size Working Cap with Sweatband Tie Back Hat Anime Printing Caps for Women Men,B08VHC9D1B,https://www.amazon.com//gp/slredirect/picassoRedirect.html/ref=pa_sp_btf_aps_sr_pg2_1?ie=UTF8&adId=A08761691WC4U7HGJQLXR&url=%2FEWAKCOT-Fashion-Calabash-Multiple-Printing%2Fdp%2FB08VHC9D1B%2Fref%3Dsr_1_104_sspa%3Fdchild%3D1%26keywords%3Dhat%26qid%3D1626700861%26sr%3D8-104-spons%26psc%3D1&qualifier=1626700861&id=2464153922601767&widgetName=sp_btf
Xeiwagoo 6 Pieces Beanie Kufi Skull Caps Knit Kufi Hat Under Helmet Beanie Hats for Men and Women,B093Y3V3RB,https://www.amazon.com//gp/slredirect/picassoRedirect.html/ref=pa_sp_btf_aps_sr_pg2_1?ie=UTF8&adId=A02128793RIPA3DAXHBWD&url=%2FXeiwagoo-Pieces-Beanie-Skull-Helmet%2Fdp%2FB093Y3V3RB%2Fref%3Dsr_1_105_sspa%3Fdchild%3D1%26keywords%3Dhat%26qid%3D1626700861%26sr%3D8-105-spons%26psc%3D1&qualifier=1626700861&id=2464153922601767&widgetName=sp_btf
"3 Pack Golf Towel, MOSUMI Golf Towel for Golf Bags with Clip, Microfiber Waffle Pattern Golf Towel,Tri-fold Golf Towel",B08TBF4PD9,https://www.amazon.com//gp/slredirect/picassoRedirect.html/ref=pa_sp_atf_next_aps_sr_pg3_1?ie=UTF8&adId=A0832747163PN9HFBO4D5&url=%2FMOSUMI-Microfiber-Waffle-Pattern-Tri-fold%2Fdp%2FB08TBF4PD9%2Fref%3Dsr_1_97_sspa%3Fdchild%3D1%26keywords%3Dhat%26qid%3D1626700864%26sr%3D8-97-spons%26psc%3D1&qualifier=1626700864&id=2305814486992406&widgetName=sp_atf_next
"farlalah Kids’ UPF 50+ Wide Brim Bucket UV Sun Protection Hats Adjustable Summer Play Hat Bucket Hat Kids Sun Hat(Blue, Medium, one_Size)",B093VMCWVD,https://www.amazon.com//gp/slredirect/picassoRedirect.html/ref=pa_sp_atf_next_aps_sr_pg3_1?ie=UTF8&adId=A015488233OZO54WA3Y4E&url=%2Ffarlalah-Bucket-Protection-Adjustable-one_Size%2Fdp%2FB093VMCWVD%2Fref%3Dsr_1_98_sspa%3Fdchild%3D1%26keywords%3Dhat%26qid%3D1626700864%26sr%3D8-98-spons%26psc%3D1&qualifier=1626700864&id=2305814486992406&widgetName=sp_atf_next
"farlalah Kids’ UPF 50+ Wide Brim Bucket UV Sun Protection Hats Adjustable Summer Play Hat Bucket Hat Kids Sun Hat (Aqua Blue, Medium, one_Size)",B093VMG7LV,https://www.amazon.com//gp/slredirect/picassoRedirect.html/ref=pa_sp_atf_next_aps_sr_pg3_1?ie=UTF8&adId=A01550701SH0OZAJEY5LY&url=%2Ffarlalah-Bucket-Protection-Adjustable-one_Size%2Fdp%2FB093VMG7LV%2Fref%3Dsr_1_99_sspa%3Fdchild%3D1%26keywords%3Dhat%26qid%3D1626700864%26sr%3D8-99-spons%26psc%3D1&qualifier=1626700864&id=2305814486992406&widgetName=sp_atf_next
"farlalah Kids’ UPF 50+ Bucket UV Sun Protection Hats Adjustable Summer Play Hat (Pink, Medium, one_Size)",B093VKK7LM,https://www.amazon.com//gp/slredirect/picassoRedirect.html/ref=pa_sp_atf_next_aps_sr_pg3_1?ie=UTF8&adId=A01552262LJLK0X1H03DR&url=%2Ffarlalah-Bucket-Protection-Adjustable-one_Size%2Fdp%2FB093VKK7LM%2Fref%3Dsr_1_100_sspa%3Fdchild%3D1%26keywords%3Dhat%26qid%3D1626700864%26sr%3D8-100-spons%26psc%3D1&qualifier=1626700864&id=2305814486992406&widgetName=sp_atf_next
"MEINICY 3PCS Classic Baseball Cap, Dad Hat Fits Men Women, All Cotton Made, Adjustable Low Profile Unconstructed",B08SC36ZPQ,https://www.amazon.com//MEINICY-Classic-Baseball-Adjustable-Unconstructed/dp/B08SC36ZPQ/ref=sr_1_101?dchild=1&keywords=hat&qid=1626700864&sr=8-101
adidas Men's Decision Cap,B076QNVT6S,https://www.amazon.com//adidas-Decision-Structured-Adjustable-White/dp/B076QNVT6S/ref=sr_1_102?dchild=1&keywords=hat&qid=1626700864&sr=8-102
adidas Men's UPF Golf Sun Hat,B07SKLKVP4,https://www.amazon.com//adidas-Golf-White-Small-Medium/dp/B07SKLKVP4/ref=sr_1_103?dchild=1&keywords=hat&qid=1626700864&sr=8-103
"adidas Originals Women's Relaxed Tie Dye Strapback Cap, Black/White, ONE SIZE",B07D9HXXKB,https://www.amazon.com//adidas-Originals-Relaxed-Adjustable-Strapback/dp/B07D9HXXKB/ref=sr_1_104?dchild=1&keywords=hat&qid=1626700864&sr=8-104
"Bucket Hats for Women,Summer Travel Beach Sun Hat Outdoor Cap,Packable Teens Girls Bucket Hat UPF 50+",B08RNKGZSG,https://www.amazon.com//Bucket-Summer-Travel-Outdoor-Packable/dp/B08RNKGZSG/ref=sr_1_105?dchild=1&keywords=hat&qid=1626700864&sr=8-105
Lenikis Unisex Outdoor Activities UV Protecting Sun Hats with Neck Flap,B0151A6UQQ,https://www.amazon.com//Lenikis-Unisex-Outdoor-Activities-Protecting/dp/B0151A6UQQ/ref=sr_1_106?dchild=1&keywords=hat&qid=1626700864&sr=8-106
2021 Flatbill Trucker Hat,B08SCGGTSQ,https://www.amazon.com//2021-Flatbill-Trucker-Hat-Navy/dp/B08SCGGTSQ/ref=sr_1_107?dchild=1&keywords=hat&qid=1626700864&sr=8-107
Sunday Afternoons Havana Hat,B00B8IG3V8,https://www.amazon.com//Sunday-Afternoons-Havana-Hat-Small/dp/B00B8IG3V8/ref=sr_1_108?dchild=1&keywords=hat&qid=1626700864&sr=8-108
John Deere NCAA mens Logo Mesh Back Core Baseball Cap,B079F5W7XP,https://www.amazon.com//John-Deere-Service-Equipment-Snapback/dp/B079F5W7XP/ref=sr_1_109?dchild=1&keywords=hat&qid=1626700864&sr=8-109
Under Armour Men's Iso-chill ArmourVent Fitted Baseball Cap,B089KKJFBH,https://www.amazon.com//Under-Armour-Iso-Chill-Armourvent-Baseball/dp/B089KKJFBH/ref=sr_1_110?dchild=1&keywords=hat&qid=1626700864&sr=8-110
Under Armour Men's Blank Blitzing Cap,B07J1YR6P7,https://www.amazon.com//Under-Armour-Blank-Blitzing-X-Large/dp/B07J1YR6P7/ref=sr_1_111?dchild=1&keywords=hat&qid=1626700864&sr=8-111
"Vineyard Vines Men's Classic Whale Logo Baseball Hat, Light Blue, ONE Size",B084LLWSL6,https://www.amazon.com//Vineyard-Vines-Classic-Whale-Baseball/dp/B084LLWSL6/ref=sr_1_112?dchild=1&keywords=hat&qid=1626700864&sr=8-112
Birds Aren't Real Rainbow Hat,B08LW5PYQN,https://www.amazon.com//gp/slredirect/picassoRedirect.html/ref=pa_sp_mtf_aps_sr_pg3_1?ie=UTF8&adId=A049191610ILJC9Y2UXQ0&url=%2FBirds-Arent-Real-Rainbow-Hat%2Fdp%2FB08LW5PYQN%2Fref%3Dsr_1_113_sspa%3Fdchild%3D1%26keywords%3Dhat%26qid%3D1626700864%26sr%3D8-113-spons%26psc%3D1&qualifier=1626700864&id=2305814486992406&widgetName=sp_mtf
"adidas Women's Adizero II Cap, Tribe Purple/White/Glow, One Size",B00DEJLYKY,https://www.amazon.com//adidas-Womens-Adizero-Tribe-Purple/dp/B00DEJLYKY/ref=sr_1_114?dchild=1&keywords=hat&qid=1626700864&sr=8-114
Callaway Golf 2020 Sun Hat,B07YVTLK76,https://www.amazon.com//Callaway-Golf-2020-Sun-Hat/dp/B07YVTLK76/ref=sr_1_115?dchild=1&keywords=hat&qid=1626700864&sr=8-115
O'NEILL Men's Bucket Hat,B08L497C2B,https://www.amazon.com//ONEILL-Mens-Headwear-Graphite-Wetlands/dp/B08L497C2B/ref=sr_1_116?dchild=1&keywords=hat&qid=1626700864&sr=8-116
Simplicity Women's Wide Brim Straw Sun Hat with Lanyard UPF Summer Sun Hats for Women,B01CTWJZVQ,https://www.amazon.com//Womens-Braided-Straw-Lanyard-Ivory/dp/B01CTWJZVQ/ref=sr_1_117?dchild=1&keywords=hat&qid=1626700864&sr=8-117
PUMA Women's Evercat Running Cap,B073BYNJ93,https://www.amazon.com//PUMA-Womens-Evercat-Running-Grey/dp/B073BYNJ93/ref=sr_1_118?dchild=1&keywords=hat&qid=1626700864&sr=8-118
Sunday Afternoons Girls' Kids Play Hat,B01641DQ04,https://www.amazon.com//Sunday-Afternoons-Kids-Blossom-Medium/dp/B01641DQ04/ref=sr_1_119?dchild=1&keywords=hat&qid=1626700864&sr=8-119
"'47 NBA Clean Up Adjustable Hat, One Size",B074CK3BTN,https://www.amazon.com//47-Brand-MLB-Yankees-Clean/dp/B074CK3BTN/ref=sr_1_120?dchild=1&keywords=hat&qid=1626700864&sr=8-120
"Richardson Unisex 112 Trucker Adjustable Snapback Baseball Cap, Split Black/Charcoal, One Size Fits Most",B00HLFHWKS,https://www.amazon.com//Richardson-Adult-Unisex-Mesh-Adjustable/dp/B00HLFHWKS/ref=sr_1_121?dchild=1&keywords=hat&qid=1626700864&sr=8-121
melin Trenches Icon Hydro,B085RQGH74,https://www.amazon.com//melin-Trenches-Icon-Hydro-Navy/dp/B085RQGH74/ref=sr_1_122?dchild=1&keywords=hat&qid=1626700864&sr=8-122
adidas Youth Kids-Boy's/Girl's / Superlite Relaxed Adjustable Performance Cap,B079TQ5WDY,https://www.amazon.com//adidas-Superlite-Relaxed-Adjustable-Performance/dp/B079TQ5WDY/ref=sr_1_123?dchild=1&keywords=hat&qid=1626700864&sr=8-123
adidas Mens Amplifier Stretch Fit Structured Cap,B01MSP0AVK,https://www.amazon.com//adidas-Amplifier-Stretch-Structured-Medium/dp/B01MSP0AVK/ref=sr_1_124?dchild=1&keywords=hat&qid=1626700864&sr=8-124
Riot Society Mens Embroidered Adjustable Dad Hat,B075TRZDKF,https://www.amazon.com//Riot-Society-Bear-Embroidered-Adjustable/dp/B075TRZDKF/ref=sr_1_125?dchild=1&keywords=hat&qid=1626700864&sr=8-125
PFFY 2 Packs Baseball Cap Golf Dad Hat for Men and Women,B08ZLP5WRJ,https://www.amazon.com//gp/slredirect/picassoRedirect.html/ref=pa_sp_mtf_aps_sr_pg3_1?ie=UTF8&adId=A06430502S60C34DEB24J&url=%2FPFFY-Packs-Baseball-Women-Black%2Fdp%2FB08ZLP5WRJ%2Fref%3Dsr_1_126_sspa%3Fdchild%3D1%26keywords%3Dhat%26qid%3D1626700864%26sr%3D8-126-spons%26psc%3D1&qualifier=1626700864&id=2305814486992406&widgetName=sp_mtf
farlalah Kids’ UPF 50+ Wide Brim Neck Flap UV Sun Protection Hat Adjustable Summer Play Kids Sun Hat,B093VPGVC8,https://www.amazon.com//gp/slredirect/picassoRedirect.html/ref=pa_sp_mtf_aps_sr_pg3_1?ie=UTF8&adId=A015538225UCB9YNRS5MP&url=%2Ffarlalah-Protection-Adjustable-Summer-one_Size%2Fdp%2FB093VPGVC8%2Fref%3Dsr_1_127_sspa%3Fdchild%3D1%26keywords%3Dhat%26qid%3D1626700864%26sr%3D8-127-spons%26psc%3D1&qualifier=1626700864&id=2305814486992406&widgetName=sp_mtf
Embroidered Baseball Cap My Lucky Fishing Hat Embroidery Baseball Caps Adjustable Dad Hat Sport Hats Outdoor Sun Hats,B097TL55BP,https://www.amazon.com//gp/slredirect/picassoRedirect.html/ref=pa_sp_mtf_aps_sr_pg3_1?ie=UTF8&adId=A0364212YI5U5SSUNAS7&url=%2FEmbroidered-Baseball-Fishing-Embroidery-Adjustable%2Fdp%2FB097TL55BP%2Fref%3Dsr_1_128_sspa%3Fdchild%3D1%26keywords%3Dhat%26qid%3D1626700864%26sr%3D8-128-spons%26psc%3D1&qualifier=1626700864&id=2305814486992406&widgetName=sp_mtf
adidas Men's Superlite Performance Visor,B0748VWDPF,https://www.amazon.com//adidas-Superlite-Performance-Visor-Black/dp/B0748VWDPF/ref=sr_1_129?dchild=1&keywords=hat&qid=1626700864&sr=8-129
Tommy Hilfiger Men's Dad Hat Billy Corner Flag Cap,B077BPW44W,https://www.amazon.com//Tommy-Hilfiger-Billy-Corner-Black/dp/B077BPW44W/ref=sr_1_130?dchild=1&keywords=hat&qid=1626700864&sr=8-130
Costa Del Mar Bass Trucker Hat,B007IS8ZJ0,https://www.amazon.com//Costa-Del-Mar-Trucker-X-Large/dp/B007IS8ZJ0/ref=sr_1_131?dchild=1&keywords=hat&qid=1626700864&sr=8-131
Brixton Men's Oath Iii Medium Profile Adjustable Snapback Hat,B00E0NWHQS,https://www.amazon.com//Brixton-Medium-Profile-Adjustable-Snapback/dp/B00E0NWHQS/ref=sr_1_132?dchild=1&keywords=hat&qid=1626700864&sr=8-132
O'NEILL Men's Sonoma Print Straw Hat,B00NIVAEG8,https://www.amazon.com//ONeill-Sonoma-Prints-Straw-Naturl1/dp/B00NIVAEG8/ref=sr_1_133?dchild=1&keywords=hat&qid=1626700864&sr=8-133
Lacoste Men's Embroidered Crocodile Cotton Cap,B07731843J,https://www.amazon.com//Lacoste-Mens-Small-Strapback-White/dp/B07731843J/ref=sr_1_134?dchild=1&keywords=hat&qid=1626700864&sr=8-134
adidas Men's Adizero Crazy Light Baseball Cap,B00DEJIW3Q,https://www.amazon.com//adidas-Adizero-Crazy-Light-Aluminum/dp/B00DEJIW3Q/ref=sr_1_135?dchild=1&keywords=hat&qid=1626700864&sr=8-135
Under Armour Men's Curved Brim Stretch Fit Hat,B01FERRP6U,https://www.amazon.com//Under-Armour-Stretch-Graphite-X-Large/dp/B01FERRP6U/ref=sr_1_136?dchild=1&keywords=hat&qid=1626700864&sr=8-136
Volcom Men's Full Stone Cheese Hat,B017JFRRH2,https://www.amazon.com//Volcom-Stone-Cheese-Charcoal-Heather/dp/B017JFRRH2/ref=sr_1_137?dchild=1&keywords=hat&qid=1626700864&sr=8-137
"Carhartt Men's Rugged Professional Cap, Navy, OFA",B075LPQZDM,https://www.amazon.com//Carhartt-Mens-Rugged-Professional-Navy/dp/B075LPQZDM/ref=sr_1_138?dchild=1&keywords=hat&qid=1626700864&sr=8-138
Under Armour Women's Threadborne Fly by Cap,B0725RF1L4,https://www.amazon.com//Under-Armour-Womens-Microthread-Silver/dp/B0725RF1L4/ref=sr_1_139?dchild=1&keywords=hat&qid=1626700864&sr=8-139
Muryobao Women's Ponytail Sun Hat UV Protection Foldable Mesh Wide Brim Beach Fishing Hat,B07M6VGNHM,https://www.amazon.com//Muryobao-Ponytail-Summer-Fishing-Gardening/dp/B07M6VGNHM/ref=sr_1_140?dchild=1&keywords=hat&qid=1626700864&sr=8-140
San Diego Hat Company womens Ombre Paper Floppy,B007BQH8P6,https://www.amazon.com//San-Diego-Hat-Womens-UBLX106OSCML/dp/B007BQH8P6/ref=sr_1_141?dchild=1&keywords=hat&qid=1626700864&sr=8-141
Hurley Men's One And Only Black Flexfit Hat,B003TOI8SU,https://www.amazon.com//Hurley-Flexfit-Black-Small-Medium/dp/B003TOI8SU/ref=sr_1_142?dchild=1&keywords=hat&qid=1626700864&sr=8-142
Womens Mens Wide Brim Straw Panama Hat Fedora Summer Beach Sun Hat UPF Straw Hat for Women,B07BNNNSX5,https://www.amazon.com//Summer-Panama-Straw-Fedora-Beach/dp/B07BNNNSX5/ref=sr_1_143?dchild=1&keywords=hat&qid=1626700864&sr=8-143
adidas Women's Superlite Performance Visor,B076QM9NPY,https://www.amazon.com//adidas-Womens-Superlite-Performance-Visor/dp/B076QM9NPY/ref=sr_1_144?dchild=1&keywords=hat&qid=1626700864&sr=8-144
ARIAT Men's Aztec Black Flat Bill Cap,B06XPWBQBT,https://www.amazon.com//Ariat-Mens-Aztec-Black-Flat/dp/B06XPWBQBT/ref=sr_1_145?dchild=1&keywords=hat&qid=1626700864&sr=8-145
"Super Wide Brim Men Fishing Sun Hats, Garden Outdoor Travel Women Bucket Cap, Hiking Safari Boonie Hat",B07QF6H5RX,https://www.amazon.com//Protection-Outdoor-Waterproof-Breathable-Packable/dp/B07QF6H5RX/ref=sr_1_146?dchild=1&keywords=hat&qid=1626700864&sr=8-146
San Diego Hat Company Women's Crocheted Raffia Cowboy,B0033PRG9M,https://www.amazon.com//San-Diego-Hat-Company-Size/dp/B0033PRG9M/ref=sr_1_147?dchild=1&keywords=hat&qid=1626700864&sr=8-147
