Description,ASIN,Product URL
John Deere 100 Year Anniversary Oilskin Look Patch Casual Cap Brown,B07DNDTCMR,https://www.amazon.com//John-Deere-100-Anniversary-Oilskin/dp/B07DNDTCMR/ref=sr_1_239?dchild=1&keywords=hat&qid=1626700872&sr=8-239
Calvin Klein Men's Logo Adjustable Cap,B07PVKBHNG,https://www.amazon.com//Calvin-Klein-Adjustable-Black-White/dp/B07PVKBHNG/ref=sr_1_240?dchild=1&keywords=hat&qid=1626700872&sr=8-240
Champion Men's Classic Twill Hat,B073X5Q7FR,https://www.amazon.com//Champion-LIFE-Classic-Twill-Amaranth/dp/B073X5Q7FR/ref=sr_1_241?dchild=1&keywords=hat&qid=1626700872&sr=8-241
"prAna Embroidered Trucker Cap, Brown, One Size",B002O3Y2PA,https://www.amazon.com//prAna-Embroidered-Trucker-Brown-Size/dp/B002O3Y2PA/ref=sr_1_242?dchild=1&keywords=hat&qid=1626700872&sr=8-242
ARIAT Offset Logo Glitter Messy Bun Snapback Cap Black Glitter One Size,B07MQ67427,https://www.amazon.com//ARIAT-Womens-Offset-Glitter-Snapback/dp/B07MQ67427/ref=sr_1_243?dchild=1&keywords=hat&qid=1626700872&sr=8-243
HUK Men's Mesh Trucker Snapback Anti-Glare Fishing Hat,B08BLRKJ3P,https://www.amazon.com//HUK-Profile-Anti-Glare-Fishing-Sharkskin/dp/B08BLRKJ3P/ref=sr_1_244?dchild=1&keywords=hat&qid=1626700872&sr=8-244
adidas mens Superlite Pro Relaxed Adjustable Performance Cap,B076QNSYKL,https://www.amazon.com//adidas-Superlite-Adjustable-Performance-Reflective/dp/B076QNSYKL/ref=sr_1_245?dchild=1&keywords=hat&qid=1626700872&sr=8-245
Flexfit Men's Trucker Mesh Multicam,B082G549RR,https://www.amazon.com//Flexfit-Trucker-Mesh-Fitted-Brown/dp/B082G549RR/ref=sr_1_246?dchild=1&keywords=hat&qid=1626700872&sr=8-246
Hurley Men's Standard M Natural 2.0 Trucker Hat,B07V39MDSD,https://www.amazon.com//Hurley-Mens-Natural-Trucker-Cool/dp/B07V39MDSD/ref=sr_1_247?dchild=1&keywords=hat&qid=1626700872&sr=8-247
MAPLECOS Super Odyssey Red Hat 3D Raised Eyes Cappy Cap,B08TLTVNW4,https://www.amazon.com//gp/slredirect/picassoRedirect.html/ref=pa_sp_btf_aps_sr_pg5_1?ie=UTF8&adId=A04340772Y96KZ404ZBTM&url=%2FMAPLECOS-Super-Odyssey-Raised-Cappy-Cap%2Fdp%2FB08TLTVNW4%2Fref%3Dsr_1_248_sspa%3Fdchild%3D1%26keywords%3Dhat%26qid%3D1626700872%26sr%3D8-248-spons%26psc%3D1&qualifier=1626700872&id=6300974702595735&widgetName=sp_btf
Outdoor Sun Protection Hat Wide Brim Bucket Hats UV Protection Boonie Hat 56-62cm,B07455YP38,https://www.amazon.com//gp/slredirect/picassoRedirect.html/ref=pa_sp_btf_aps_sr_pg5_1?ie=UTF8&adId=A00088633FH0V8TIOT6BD&url=%2FYOYEAH-Outdoor-Boonie-Bucket-Fishing%2Fdp%2FB07455YP38%2Fref%3Dsr_1_249_sspa%3Fdchild%3D1%26keywords%3Dhat%26qid%3D1626700872%26sr%3D8-249-spons%26psc%3D1&qualifier=1626700872&id=6300974702595735&widgetName=sp_btf
"Neon Sparkly Glitter Space Cowboy Hat - Fun Metallic Purple Holographic Party Disco Cowgirl Hat for Birthday & Bachelorette Parties, Halloween, Raves",B08SQ9PV97,https://www.amazon.com//gp/slredirect/picassoRedirect.html/ref=pa_sp_atf_next_aps_sr_pg6_1?ie=UTF8&adId=A00572632D235UW4QH5KS&url=%2FNeon-Sparkly-Glitter-Space-Cowboy%2Fdp%2FB08SQ9PV97%2Fref%3Dsr_1_241_sspa%3Fdchild%3D1%26keywords%3Dhat%26qid%3D1626700876%26sr%3D8-241-spons%26psc%3D1&qualifier=1626700876&id=5796585982398284&widgetName=sp_atf_next
"Ansxiy Graphite Pickleball Paddles, Pro Pickleball Paddle Set of 2 Lightweight Carbon Fiber Pickleball Racket with 4 Pickleball Balls & Portable Bag Polymer Soft Non-Slip Grip",B08JTXNBCZ,https://www.amazon.com//gp/slredirect/picassoRedirect.html/ref=pa_sp_atf_next_aps_sr_pg6_1?ie=UTF8&adId=A09874282H6NNU80S0VRZ&url=%2FGraphite-Pickleball-Ansxiy-Lightweight-Honeycomb%2Fdp%2FB08JTXNBCZ%2Fref%3Dsr_1_242_sspa%3Fdchild%3D1%26keywords%3Dhat%26qid%3D1626700876%26sr%3D8-242-spons%26psc%3D1&qualifier=1626700876&id=5796585982398284&widgetName=sp_atf_next
SINA COVA Men's Adjustable Baseball Cap Golf hat Dad hat 10077720,B01G58JL8M,https://www.amazon.com//gp/slredirect/picassoRedirect.html/ref=pa_sp_atf_next_aps_sr_pg6_1?ie=UTF8&adId=A063206426NN2RM0KN59J&url=%2FCova-Sina-Mens-Cap-Free%2Fdp%2FB01G58JL8M%2Fref%3Dsr_1_243_sspa%3Fdchild%3D1%26keywords%3Dhat%26qid%3D1626700876%26sr%3D8-243-spons%26psc%3D1&qualifier=1626700876&id=5796585982398284&widgetName=sp_atf_next
Lenikis Kids Sun Hats UPF 50+ Sun Protection Hat Summer Wide Brim Bucket Hat Adjustable Strap Toddler Sun Hat,B088M28F71,https://www.amazon.com//gp/slredirect/picassoRedirect.html/ref=pa_sp_atf_next_aps_sr_pg6_1?ie=UTF8&adId=A09984572HAUB4DYE0BJJ&url=%2FHats-Toddler-Protecting-Outdoor-Activities%2Fdp%2FB088M28F71%2Fref%3Dsr_1_244_sspa%3Fdchild%3D1%26keywords%3Dhat%26qid%3D1626700876%26sr%3D8-244-spons%26psc%3D1&qualifier=1626700876&id=5796585982398284&widgetName=sp_atf_next
Straw Hat for Women Beach Hats Summer Sun Panama Wide Brim Floppy Fedora Cap UPF50+,B06XSXHP6H,https://www.amazon.com//Anycosy-Panama-Womens-Summer-%EF%BC%88A01-Beige%EF%BC%89/dp/B06XSXHP6H/ref=sr_1_245?dchild=1&keywords=hat&qid=1626700876&sr=8-245
HENSCHEL HAT COMPANY mens 5310-59 Xl,B00266YXZY,https://www.amazon.com//Henschel-Aussie-Breezer-Distress-XX-Large/dp/B00266YXZY/ref=sr_1_246?dchild=1&keywords=hat&qid=1626700876&sr=8-246
Columbia Unisex PFG Mesh Stateside Ball Cap,B07DKZNPJH,https://www.amazon.com//Columbia-Stateside-X-Large-Mountain-Triangle/dp/B07DKZNPJH/ref=sr_1_247?dchild=1&keywords=hat&qid=1626700876&sr=8-247
Cat Caterpillar Equipment Neon Charcoal/Orange Safety Snapback Mesh Cap/Hat,B079DD6PXV,https://www.amazon.com//Cat-Caterpillar-Equipment-Charcoal-Snapback/dp/B079DD6PXV/ref=sr_1_248?dchild=1&keywords=hat&qid=1626700876&sr=8-248
HOOEY Roughy Boys/Youth Mesh Adjustable Brown/Black Trucker Cap,B085QMY3PG,https://www.amazon.com//HOOEY-Mens-Roughy-Mesh-Brown/dp/B085QMY3PG/ref=sr_1_249?dchild=1&keywords=hat&qid=1626700876&sr=8-249
prAna Men's Luke Cadet Cap,B008FPZCXM,https://www.amazon.com//prAna-Mens-Luke-Cadet-Size/dp/B008FPZCXM/ref=sr_1_250?dchild=1&keywords=hat&qid=1626700876&sr=8-250
Under Armour Men's Freedom Blitzing Hat,B089G2WLVZ,https://www.amazon.com//Under-Armour-Freedom-Blitzing-XX-Large/dp/B089G2WLVZ/ref=sr_1_251?dchild=1&keywords=hat&qid=1626700876&sr=8-251
LINDO Trucker Hat - The Great Outdoors,B06WV7411J,https://www.amazon.com//Lindo-Trucker-Hat-Outdoors-Collection/dp/B06WV7411J/ref=sr_1_252?dchild=1&keywords=hat&qid=1626700876&sr=8-252
Lacoste Men's Side Croc Twill Adjustable Leather Strap Hat,B07SRVXKQ8,https://www.amazon.com//Lacoste-Twill-Adjustable-Leather-Strap/dp/B07SRVXKQ8/ref=sr_1_253?dchild=1&keywords=hat&qid=1626700876&sr=8-253
John Deere Farm State Pride Mesh Back Trucker Hat,B07PDZTHP3,https://www.amazon.com//John-Deere-State-Cap-Green-Yellow-Florida/dp/B07PDZTHP3/ref=sr_1_254?dchild=1&keywords=hat&qid=1626700876&sr=8-254
boderier Sun Hats for Women Summer Casual Wide Brim Cotton Bucket Hat Beach Vacation Travel Accessories,B07QH587ZV,https://www.amazon.com//boderier-Summer-Casual-Vacation-Accessories/dp/B07QH587ZV/ref=sr_1_255?dchild=1&keywords=hat&qid=1626700876&sr=8-255
Life is Good Adult Chill Cap Baseball Hat,B0784VM646,https://www.amazon.com//Life-Good-Chill-Mountains-Darkest/dp/B0784VM646/ref=sr_1_256?dchild=1&keywords=hat&qid=1626700876&sr=8-256
Under Armour womens Play Up Cap,B08NWJ3XNZ,https://www.amazon.com//Under-Armour-Womens-Play-White/dp/B08NWJ3XNZ/ref=sr_1_257?dchild=1&keywords=hat&qid=1626700876&sr=8-257
RVCA Men's Adjustable Snapback Hat,B00QCCFZC8,https://www.amazon.com//RVCA-Twill-Snapback-Black-Charcoal/dp/B00QCCFZC8/ref=sr_1_258?dchild=1&keywords=hat&qid=1626700876&sr=8-258
Caterpillar Men's Trademark Microsuede Cap,B000ZFWLUC,https://www.amazon.com//Caterpillar-Mens-Trademark-Microsuede-Black/dp/B000ZFWLUC/ref=sr_1_259?dchild=1&keywords=hat&qid=1626700876&sr=8-259
adidas Commander Military Cap,B004J8HJZ8,https://www.amazon.com//adidas-Commander-Military-Black-XX-Large/dp/B004J8HJZ8/ref=sr_1_260?dchild=1&keywords=hat&qid=1626700876&sr=8-260
ARIAT Men's Navy Center Logo,B01KMLAIOE,https://www.amazon.com//Ariat-Mens-Navy-Center-Logo/dp/B01KMLAIOE/ref=sr_1_261?dchild=1&keywords=hat&qid=1626700876&sr=8-261
Costa Del Mar Marlin Trucker Hat,B0072ICU6A,https://www.amazon.com//Costa-Del-Mar-Trucker-X-Large/dp/B0072ICU6A/ref=sr_1_262?dchild=1&keywords=hat&qid=1626700876&sr=8-262
Hurley Men's Baseball,B0849PZBT4,https://www.amazon.com//Hurley-Seacliff-Baseball-Cargo-Khaki/dp/B0849PZBT4/ref=sr_1_263?dchild=1&keywords=hat&qid=1626700876&sr=8-263
Roxy Women's Truckin Trucker Hat,B08S6X6H47,https://www.amazon.com//Roxy-Womens-Truckin-Trucker-Corsair/dp/B08S6X6H47/ref=sr_1_264?dchild=1&keywords=hat&qid=1626700876&sr=8-264
Adidas Regent II A-Flex Cap,B002HORAPU,https://www.amazon.com//adidas-Regent-Flex-Yellow-Medium/dp/B002HORAPU/ref=sr_1_265?dchild=1&keywords=hat&qid=1626700876&sr=8-265
Magpul Standard Trucker Hat Snap Back Baseball Cap,B084P3TBRZ,https://www.amazon.com//Magpul-Bang-Trucker-Charcoal-Black/dp/B084P3TBRZ/ref=sr_1_266?dchild=1&keywords=hat&qid=1626700876&sr=8-266
Gaiam Women's Classic Fitness Hat,B08SZ5P9TJ,https://www.amazon.com//Gaiam-Womens-Classic-Fitness-Leopard/dp/B08SZ5P9TJ/ref=sr_1_267?dchild=1&keywords=hat&qid=1626700876&sr=8-267
Sunday Afternoons Shade Goddess,B075QGZNLV,https://www.amazon.com//Sunday-Afternoons-Shade-Goddess-Black/dp/B075QGZNLV/ref=sr_1_268?dchild=1&keywords=hat&qid=1626700876&sr=8-268
"Made Here Classic Dad Hat, Men/Women",B08B9NR4SZ,https://www.amazon.com//gp/slredirect/picassoRedirect.html/ref=pa_sp_mtf_aps_sr_pg6_1?ie=UTF8&adId=A0371331SQ3FRWFXCNHL&url=%2FMade-Here-Soaring-Eagle-Women%2Fdp%2FB08B9NR4SZ%2Fref%3Dsr_1_269_sspa%3Fdchild%3D1%26keywords%3Dhat%26qid%3D1626700876%26sr%3D8-269-spons%26psc%3D1&qualifier=1626700876&id=5796585982398284&widgetName=sp_mtf
KOOLSOLY Breathable Wide Brim Boonie Hat Outdoor Waterproof UPF 50+ Sun Protection Mesh Safari Sun hat for Travel Fishing,B07TLVY26C,https://www.amazon.com//gp/slredirect/picassoRedirect.html/ref=pa_sp_mtf_aps_sr_pg6_1?ie=UTF8&adId=A00967768IMNUZX4ZRJ&url=%2FKOOLSOLY-Breathable-Outdoor-Waterproof-Protection%2Fdp%2FB07TLVY26C%2Fref%3Dsr_1_270_sspa%3Fdchild%3D1%26keywords%3Dhat%26qid%3D1626700876%26sr%3D8-270-spons%26psc%3D1&qualifier=1626700876&id=5796585982398284&widgetName=sp_mtf
Xeiwagoo 4 Pieces Kufi Hat Skull Cap Beanie Hats Under Helmet Beanie hat for Men and Women,B093Y58MLD,https://www.amazon.com//gp/slredirect/picassoRedirect.html/ref=pa_sp_mtf_aps_sr_pg6_1?ie=UTF8&adId=A02127552VCB9116VMOT6&url=%2FXeiwagoo-Pieces-Skull-Beanie-Helmet%2Fdp%2FB093Y58MLD%2Fref%3Dsr_1_271_sspa%3Fdchild%3D1%26keywords%3Dhat%26qid%3D1626700876%26sr%3D8-271-spons%26psc%3D1&qualifier=1626700876&id=5796585982398284&widgetName=sp_mtf
RVCA Men's Va Logo Patch Snapback Hat,B07L6CGJF2,https://www.amazon.com//RVCA-Mens-Patch-Snapback-Black/dp/B07L6CGJF2/ref=sr_1_272?dchild=1&keywords=hat&qid=1626700876&sr=8-272
Hermitshell Baseball Hat Case Hard Travel Cap Carrier Case Holder for 6 Caps Hat Bag,B089GNX411,https://www.amazon.com//Hermitshell-Baseball-Travel-Carrier-Holder/dp/B089GNX411/ref=sr_1_273?dchild=1&keywords=hat&qid=1626700876&sr=8-273
ARIAT Men's Full Oil Corner Logo,B01C3H4V1G,https://www.amazon.com//ARIAT-Mens-Full-Corner-Brown/dp/B01C3H4V1G/ref=sr_1_274?dchild=1&keywords=hat&qid=1626700876&sr=8-274
Halo Headband Skull Cap - The Ultimate High Performance Skull Cap,B00318BKHK,https://www.amazon.com//Halo-Headbands-Skull-Cap-White/dp/B00318BKHK/ref=sr_1_275?dchild=1&keywords=hat&qid=1626700876&sr=8-275
Under Armour Men's Branded Hat,B086ZN66MN,https://www.amazon.com//Under-Armour-Mens-Branded-Black/dp/B086ZN66MN/ref=sr_1_276?dchild=1&keywords=hat&qid=1626700876&sr=8-276
John Deere NCAA mens Waxed Canvas Embroidery,B0045EFNW2,https://www.amazon.com//John-Deere-Embroidered-Logo-Baseball/dp/B0045EFNW2/ref=sr_1_277?dchild=1&keywords=hat&qid=1626700876&sr=8-277
"Tilley Endurables LTM3 Airflo Hat,Khaki/Olive,7.5",B000O7LA1M,https://www.amazon.com//Tilley-Endurables-LTM3-Airflo-Khaki/dp/B000O7LA1M/ref=sr_1_278?dchild=1&keywords=hat&qid=1626700876&sr=8-278
Quiksilver Men's Final Stretch Fit Hat,B08CZNJ4HS,https://www.amazon.com//Quiksilver-Mens-Stretch-Blazer-Final/dp/B08CZNJ4HS/ref=sr_1_279?dchild=1&keywords=hat&qid=1626700876&sr=8-279
Womens Mens Hiking Fishing Hat Waterproof Nylon Wide Brim Hat with Large Neck Flap UPF 50+ Sun Protection Hats for Women&Men,B07SJQGKQS,https://www.amazon.com//Camptrace-Outdoor-Ponytail-Packable-Protection/dp/B07SJQGKQS/ref=sr_1_280?dchild=1&keywords=hat&qid=1626700876&sr=8-280
Volcom Men's Quarter Twill Snapback Hat,B00LOUM6UM,https://www.amazon.com//Volcom-Mens-Quarter-Twill-Black/dp/B00LOUM6UM/ref=sr_1_281?dchild=1&keywords=hat&qid=1626700876&sr=8-281
Titleist Golf- Tour Elite Cap Legacy Collection Charcoal/White Small/Medium,B084H35N37,https://www.amazon.com//Titleist-Tour-Elite-Hat-Legacy/dp/B084H35N37/ref=sr_1_282?dchild=1&keywords=hat&qid=1626700876&sr=8-282
RVCA Men's Ticket Trucker Hat,B082G3TGMT,https://www.amazon.com//RVCA-Mens-Ticket-Trucker-Black/dp/B082G3TGMT/ref=sr_1_283?dchild=1&keywords=hat&qid=1626700876&sr=8-283
Sunday Afternoons Women's Sunset Hat,B08R19F32F,https://www.amazon.com//Sunday-Afternoons-Womens-Standard-Sunset/dp/B08R19F32F/ref=sr_1_284?dchild=1&keywords=hat&qid=1626700876&sr=8-284
Amazon Essentials Men's Baseball Cap,B07YGJZSXF,https://www.amazon.com//Amazon-Essentials-Standard-Baseball-Black/dp/B07YGJZSXF/ref=sr_1_285?dchild=1&keywords=hat&qid=1626700876&sr=8-285
"Hairbrella Women’s Rain Hat, Waterproof, Sun Protection, Satin-Lined, Packable",B072FSF34Y,https://www.amazon.com//Womens-Waterproof-Coverage-Protective-Collapsible/dp/B072FSF34Y/ref=sr_1_286?dchild=1&keywords=hat&qid=1626700876&sr=8-286
"John Deere Workwear Waxed Canvas Hat W/Patch, Brown",B0859MCZCN,https://www.amazon.com//John-Deere-Workwear-Waxed-Canvas/dp/B0859MCZCN/ref=sr_1_287?dchild=1&keywords=hat&qid=1626700876&sr=8-287
FURTALK Sun Hats for Women Summer Wide Brim UV UPF 50+ Panama Fedora Foldable Packable Straw Beach Hat,B0852HFS74,https://www.amazon.com//FURTALK-Summer-Panama-Foldable-Packable/dp/B0852HFS74/ref=sr_1_288?dchild=1&keywords=hat&qid=1626700876&sr=8-288
HUK Men's Trucker Anti-Glare Fishing Snapback Hat,B08BJVRMRT,https://www.amazon.com//HUK-Trucker-Anti-Glare-Fishing-Shield/dp/B08BJVRMRT/ref=sr_1_289?dchild=1&keywords=hat&qid=1626700876&sr=8-289
adidas Originals womens Trainer II Relaxed Fit Cap,B0734VD8X7,https://www.amazon.com//adidas-Womens-Originals-Trainer-Relaxed/dp/B0734VD8X7/ref=sr_1_290?dchild=1&keywords=hat&qid=1626700876&sr=8-290
Beach Hats for Women Criss Cross Ponytail Hat Sombreros para Mujer High Ponytail Baseball Cap Beanies Gorras De Mujer,B096VPV5K6,https://www.amazon.com//Ponytail-Sombreros-Baseball-Beanies-Gorras/dp/B096VPV5K6/ref=sr_1_291?dchild=1&keywords=hat&qid=1626700876&sr=8-291
prAna Women's Vista Trucker,B084DJGPW3,https://www.amazon.com//prAna-Unisex-Vista-Trucker-Charcoal/dp/B084DJGPW3/ref=sr_1_292?dchild=1&keywords=hat&qid=1626700876&sr=8-292
Flexfit Men's Melange Stretch Mesh Cap,B07STK3CDM,https://www.amazon.com//Flexfit-Melange-Trucker-Heather-Charcoal/dp/B07STK3CDM/ref=sr_1_293?dchild=1&keywords=hat&qid=1626700876&sr=8-293
Uphily unisex-adult mens Baseball,B08612XZZ5,https://www.amazon.com//American-Baseball-Profile-Patriotic-Snapback/dp/B08612XZZ5/ref=sr_1_294?dchild=1&keywords=hat&qid=1626700876&sr=8-294
Goorin Bros. Men's Animal Farm Snap Back Trucker Hat,B01DOPE19S,https://www.amazon.com//Goorin-Bros-Animal-Trucker-Black/dp/B01DOPE19S/ref=sr_1_295?dchild=1&keywords=hat&qid=1626700876&sr=8-295
Lenikis Unisex Outdoor Activities UV Protecting Sun Hats with Neck Flap,B011G9XZLE,https://www.amazon.com//gp/slredirect/picassoRedirect.html/ref=pa_sp_btf_aps_sr_pg6_1?ie=UTF8&adId=A02822193D937PX98OQV0&url=%2FLenikis-Unisex-Outdoor-Activities-Protecting%2Fdp%2FB011G9XZLE%2Fref%3Dsr_1_296_sspa%3Fdchild%3D1%26keywords%3Dhat%26qid%3D1626700876%26sr%3D8-296-spons%26psc%3D1&qualifier=1626700876&id=5796585982398284&widgetName=sp_btf
Eisbär RIPP Men's Hat,B07WMRPDMX,https://www.amazon.com//gp/slredirect/picassoRedirect.html/ref=pa_sp_btf_aps_sr_pg6_1?ie=UTF8&adId=A04463356EPRLUDT074O&url=%2FEisb%25C3%25A4r-RIPP-Winter-Hat-Chianti%2Fdp%2FB07WMRPDMX%2Fref%3Dsr_1_297_sspa%3Fdchild%3D1%26keywords%3Dhat%26qid%3D1626700876%26sr%3D8-297-spons%26psc%3D1&qualifier=1626700876&id=5796585982398284&widgetName=sp_btf
"URTEOM Bow Ties for Men, Diamond Pointed Pre-Tied Banquet Bowtie for Groomsmen",B088LTWTZ4,https://www.amazon.com//gp/slredirect/picassoRedirect.html/ref=pa_sp_atf_next_aps_sr_pg7_1?ie=UTF8&adId=A0155987S7IG4E21BEZI&url=%2FDiamond-Pre-tied-Adjustable-Beautiful-Feathers%2Fdp%2FB088LTWTZ4%2Fref%3Dsr_1_289_sspa%3Fdchild%3D1%26keywords%3Dhat%26qid%3D1626700880%26sr%3D8-289-spons%26psc%3D1&qualifier=1626700880&id=955094698700681&widgetName=sp_atf_next
Binske Baseball Cap - Adjustable Dad Hat for Men or Women,B08D3Y4VMW,https://www.amazon.com//gp/slredirect/picassoRedirect.html/ref=pa_sp_atf_next_aps_sr_pg7_1?ie=UTF8&adId=A036596632JR8Z1Y34LRV&url=%2FBinske-Baseball-Cap-Adjustable-Women%2Fdp%2FB08D3Y4VMW%2Fref%3Dsr_1_290_sspa%3Fdchild%3D1%26keywords%3Dhat%26qid%3D1626700880%26sr%3D8-290-spons%26psc%3D1&qualifier=1626700880&id=955094698700681&widgetName=sp_atf_next
FrLoveAriel Adjustable Wide Brim Sunhat for Baby Girl Boy Kids Toddler Sun Hat,B08Z85KS4B,https://www.amazon.com//gp/slredirect/picassoRedirect.html/ref=pa_sp_atf_next_aps_sr_pg7_1?ie=UTF8&adId=A02197802YSE6EWJPQXAV&url=%2FFrLoveAriel-Baby-Toddler-Protection-White%2Fdp%2FB08Z85KS4B%2Fref%3Dsr_1_291_sspa%3Fdchild%3D1%26keywords%3Dhat%26qid%3D1626700880%26sr%3D8-291-spons%26psc%3D1&qualifier=1626700880&id=955094698700681&widgetName=sp_atf_next
"Made Here Classic Dad Hat, Men/Women",B08B9RLKWP,https://www.amazon.com//gp/slredirect/picassoRedirect.html/ref=pa_sp_atf_next_aps_sr_pg7_1?ie=UTF8&adId=A0371831SLZXGIP8DWOL&url=%2FMade-Here-Soaring-Eagle-White%2Fdp%2FB08B9RLKWP%2Fref%3Dsr_1_292_sspa%3Fdchild%3D1%26keywords%3Dhat%26qid%3D1626700880%26sr%3D8-292-spons%26psc%3D1&qualifier=1626700880&id=955094698700681&widgetName=sp_atf_next
Pistil Women's Marisa Sun Hat,B013WDIBVQ,https://www.amazon.com//Pistil-Womens-Marisa-Sunhat-Marine/dp/B013WDIBVQ/ref=sr_1_293?dchild=1&keywords=hat&qid=1626700880&sr=8-293
Brixton Men's Crest C Mp Snbk,B083FL69CW,https://www.amazon.com//Brixton-Mens-Crest-SNBK-Black/dp/B083FL69CW/ref=sr_1_294?dchild=1&keywords=hat&qid=1626700880&sr=8-294
adidas Women's Adizero ll Cap,B008THOYZI,https://www.amazon.com//adidas-Adizero-Relaxed-Adjustable-Performance/dp/B008THOYZI/ref=sr_1_295?dchild=1&keywords=hat&qid=1626700880&sr=8-295
FROGG TOGGS Men's Waterproof Breathable Boonie Hat,B07VWBWTNS,https://www.amazon.com//FROGG-TOGGS-Waterproof-Realtree-Adjustable/dp/B07VWBWTNS/ref=sr_1_296?dchild=1&keywords=hat&qid=1626700880&sr=8-296
ARIAT Aztec Logo Ball Cap,B0757HH2BK,https://www.amazon.com//Ariat-Womens-Aztec-Turquoise-Coral/dp/B0757HH2BK/ref=sr_1_297?dchild=1&keywords=hat&qid=1626700880&sr=8-297
Tilley mens Outdoor Hat,B000E9FSPY,https://www.amazon.com//Tilley-Endurables-LTM3-Airflo-Natural/dp/B000E9FSPY/ref=sr_1_298?dchild=1&keywords=hat&qid=1626700880&sr=8-298
Quiksilver Men's Outsider Americana,B08HPLGJQF,https://www.amazon.com//Quiksilver-Mens-Outsider-Americana-Blazer/dp/B08HPLGJQF/ref=sr_1_299?dchild=1&keywords=hat&qid=1626700880&sr=8-299
John Deere Mens Oilskin,B073C71PCY,https://www.amazon.com//John-Deere-Oilskin-Charcoal-Embroidered/dp/B073C71PCY/ref=sr_1_300?dchild=1&keywords=hat&qid=1626700880&sr=8-300
"Tilley Endurables LTM3 Airflo Hat,Khaki/Olive,7.375",B000E9DQU8,https://www.amazon.com//Tilley-Endurables-LTM3-Airflo-Khaki/dp/B000E9DQU8/ref=sr_1_301?dchild=1&keywords=hat&qid=1626700880&sr=8-301
Columbia Rugged Outdoor Mesh Hat,B089F67PT3,https://www.amazon.com//Columbia-Rugged-Outdoor-Jasper-Collegiate/dp/B089F67PT3/ref=sr_1_302?dchild=1&keywords=hat&qid=1626700880&sr=8-302
RICHARDSON 112 Trucker OSFA Baseball HAT Ball Cap,B08KM1QC1Z,https://www.amazon.com//RICHARDSON-Trucker-OSFA-Baseball-Black/dp/B08KM1QC1Z/ref=sr_1_303?dchild=1&keywords=hat&qid=1626700880&sr=8-303
"Tilley Endurables LTM3 Airflo Hat,Khaki/Olive,7.125",B000E9A02U,https://www.amazon.com//Tilley-Endurables-LTM3-Airflo-Khaki/dp/B000E9A02U/ref=sr_1_304?dchild=1&keywords=hat&qid=1626700880&sr=8-304
Kangol mens Flat,B07HB85PHY,https://www.amazon.com//Kangol-Women-Tropic-Ventair-Black/dp/B07HB85PHY/ref=sr_1_305?dchild=1&keywords=hat&qid=1626700880&sr=8-305
Under Armour Women's Microthread Renegade Hat,B072BXH9SZ,https://www.amazon.com//Under-Armour-Renegade-Graphite-Brilliance/dp/B072BXH9SZ/ref=sr_1_306?dchild=1&keywords=hat&qid=1626700880&sr=8-306
Lack of Color Women's Palma Wide Fedora,B07Q26LBC6,https://www.amazon.com//Lack-Color-Womens-Natural-X-Large/dp/B07Q26LBC6/ref=sr_1_307?dchild=1&keywords=hat&qid=1626700880&sr=8-307
Salty Crew Bruce Straw Hat Mens,B0867J9NMR,https://www.amazon.com//Salty-Crew-Bruce-Straw-Black/dp/B0867J9NMR/ref=sr_1_308?dchild=1&keywords=hat&qid=1626700880&sr=8-308
Timberland Men's Cotton Canvas Baseball Cap,B07HY1VBRK,https://www.amazon.com//Timberland-Soundview-Cotton-Canvas-Black/dp/B07HY1VBRK/ref=sr_1_309?dchild=1&keywords=hat&qid=1626700880&sr=8-309
Lisianthus Women Belt Buckle Fedora Hat,B0716JJGQW,https://www.amazon.com//Lisianthus-Women-Buckle-Fedora-Dark-Camel/dp/B0716JJGQW/ref=sr_1_310?dchild=1&keywords=hat&qid=1626700880&sr=8-310
elope The Clucker Hat,B000CNF3U2,https://www.amazon.com//gp/slredirect/picassoRedirect.html/ref=pa_sp_mtf_aps_sr_pg7_1?ie=UTF8&adId=A09814443UF9R1IKFV3WO&url=%2Felope-250510-The-Clucker%2Fdp%2FB000CNF3U2%2Fref%3Dsr_1_311_sspa%3Fdchild%3D1%26keywords%3Dhat%26qid%3D1626700880%26sr%3D8-311-spons%26psc%3D1&qualifier=1626700880&id=955094698700681&widgetName=sp_mtf
"AOSMI 3 Pack Vintage Washed Cotton Adjustable Baseball Caps Men and Women, Unstructured Low Profile Plain Classic Dad Hat",B08SQX2R11,https://www.amazon.com//gp/slredirect/picassoRedirect.html/ref=pa_sp_mtf_aps_sr_pg7_1?ie=UTF8&adId=A08484993VAQX3ZKKJTQ6&url=%2FVintage-Baseball-Adjustable-Unstructured-Profile%2Fdp%2FB08SQX2R11%2Fref%3Dsr_1_312_sspa%3Fdchild%3D1%26keywords%3Dhat%26qid%3D1626700880%26sr%3D8-312-spons%26psc%3D1&qualifier=1626700880&id=955094698700681&widgetName=sp_mtf
"LADYBRO 2Pack Unisex Flat Cap Newsboy Hats for Men Women, Scally Cap Summer Hat for Golf",B094FCRK3P,https://www.amazon.com//gp/slredirect/picassoRedirect.html/ref=pa_sp_mtf_aps_sr_pg7_1?ie=UTF8&adId=A09433051ULMS9YLZINX4&url=%2FLADYBRO-Unisex-Newsboy-Scally-Summer%2Fdp%2FB094FCRK3P%2Fref%3Dsr_1_313_sspa%3Fdchild%3D1%26keywords%3Dhat%26qid%3D1626700880%26sr%3D8-313-spons%26psc%3D1&qualifier=1626700880&id=955094698700681&widgetName=sp_mtf
"GearTOP Fishing Hat Outdoor Sun Protection Hats for Men & Women, Boonie Hat - Discoverer Series…",B08B9DTQ3J,https://www.amazon.com//gp/slredirect/picassoRedirect.html/ref=pa_sp_btf_aps_sr_pg7_1?ie=UTF8&adId=A0699679K1POB8KYPA2O&url=%2FGearTOP-Fishing-Outdoor-Protection-Boonie%2Fdp%2FB08B9DTQ3J%2Fref%3Dsr_1_314_sspa%3Fdchild%3D1%26keywords%3Dhat%26qid%3D1626700880%26sr%3D8-314-spons%26psc%3D1&qualifier=1626700880&id=955094698700681&widgetName=sp_btf
KOOLSOLY Breathable Wide Brim Boonie Hat Outdoor Waterproof UPF 50+ Sun Protection Mesh Safari Sun hat for Travel Fishing,B07TLWM39M,https://www.amazon.com//gp/slredirect/picassoRedirect.html/ref=pa_sp_btf_aps_sr_pg7_1?ie=UTF8&adId=A00968762TGGZ4ZJ2URXX&url=%2FKOOLSOLY-Breathable-Outdoor-Waterproof-Protection%2Fdp%2FB07TLWM39M%2Fref%3Dsr_1_315_sspa%3Fdchild%3D1%26keywords%3Dhat%26qid%3D1626700880%26sr%3D8-315-spons%26psc%3D1&qualifier=1626700880&id=955094698700681&widgetName=sp_btf
